major-code,learning-outcomes-id,learning-outcomes
CSEC-MAJ,2,"Apply a range of modelling, management, analytics and visualisation techniques to handle relevant defensive as well as offensive cyber security operations"
CSEC-MAJ,3,Reverse-engineer systems based on minimal outside information
CSEC-MAJ,4,Communicate and present their knowledge of cyber security to diverse audiences
DEMO-MAJ,1,demonstrate an understanding of demographic changes in the world and their major determinants;
DEMO-MAJ,2,"draw on demographic methods and population theories to explain past, present and future population characteristics;"
DEMO-MAJ,3,apply demographic concepts and theories to understand contemporary socio-economic issues and current affairs;
DEMO-MAJ,4,examine policy issues based on demographic concepts and theories; and
DEMO-MAJ,5,construct an evidence-based argument on population issues using a demographic perspective.
DEST-MAJ,1,understand the different perspectives and theories of development and change in the modern era;
DEST-MAJ,2,apply these perspectives and theories to the practical issues of delivering development programs;
DEST-MAJ,3,"analyse the competing interests, motivations and discourse of key stakeholders and interest groups; and"
DEST-MAJ,4,devise and conduct research and write critically about these issues.
,0,nil
DIHU-MAJ,1,"apply theoretical frameworks  and research techniques critically in order to understand the key issues  raised by the digital humanities, and by the use of information technologies  in the arts and social sciences more generally;"
DIHU-MAJ,2,identify and analyse relevant sources of online information and assess their importance and reliability within the context of the student's disciplinary background;
DIHU-MAJ,3,evaluate ideas and  projects to assess the impact of digital technologies on humanities research  and make connections between different disciplinary approaches and methods;
DIHU-MAJ,4,"communicate and debate  effectively with others, both orally and in writing, using a variety of media  and communication platforms; and"
DIHU-MAJ,5,"understand the ethical  implications of ideas, actions, and communications undertaken online."
DTSC-MAJ,0,nil
EART-MAJ,1,"Gather and interpret data from a wide range of Earth Science disciplines, using a variety of techniques."
EART-MAJ,2,Develop theoretical and practical skills required for Earth Sciences.
EART-MAJ,3,Have an understanding of the history of and debates within the discipline of Geology and how they have influenced modern Earth Science.
EART-MAJ,4,"Apply an understanding of time (evolution of continents, oceans and life over billions of years) and space (nano to planetary scales) to a variety of contexts."
EART-MAJ,5,"Perform process-oriented, multidisciplinary studies to critically evaluate models and test hypotheses on how our planet works."
EART-MAJ,6,"Write scientific reports, and communicate effectively with university staff, peer students and the wider community on Earth Science topics."
EART-MAJ,7,Conduct themselves in a way that reflects professional expectations within the discipline.
ECST-MAJ,1,"Demonstrate an understanding of the roles played by consumers, producers and government institutions as the major components of a modern economy."
ECST-MAJ,2,Demonstrate an understanding of the basic principles and theory used in designing economic solutions to real world problems.
ECST-MAJ,3,"Apply economic models of how individuals make decisions and interact, the ways that businesses are structured and compete, and the role of government in economic activity in order to it improve economic, social and business outcomes."
ECST-MAJ,4,"Apply economic ideas to problems in other fields such as politics, science and engineering."
ECST-MAJ,5,Synthesise and communicate economic ideas in modes appropriate to a variety of audiences.
ECST-MAJ,6,Demonstrate the ability to work both independently and collaboratively with others.
EEOB-MAJ,1,Explain the evolutionary processes and the major evolutionary innovations that have led to the diversity of extant plant and animal life.
EEOB-MAJ,2,Demonstrate and apply knowledge of the structures and processes involved in the functioning of plants and animals.
EEOB-MAJ,3,"Describe the nature of interactions between and among plants and animals, and describe the important processes governing the dynamics of plant and animal communities."
EEOB-MAJ,4,"Explain how biology is an evidence-based discipline involving observation, experimentation and hypothesis testing and how it relates to other scientific disciplines."
EEOB-MAJ,5,Develop and implement experimental strategies to investigate different biological and experimental systems and analyse and present results of these investigations.
EEOB-MAJ,6,"Critically assess biological information and apply it to theoretical, experimental and professional contexts."
EEOB-MAJ,7,"Employ their collaborative and independent educational experiences of laboratory, project and course work in other contexts."
EEOB-MAJ,8,Clearly communicate biological processes and principles to both science literate and non-science literate audiences.
EEOB-MAJ,9,"Recognise how biology contributes to resolving ethical, social and environmental issues and the expectations this places on their professional practice."
EHIS-MAJ,1,"recognise and reflect
     on the political, social, economic, and cultural factors that have shaped
     Europe over the past millennium."
EHIS-MAJ,2,"evaluate competing
     accounts of European historical development and changing representations
     of Europe's past."
EHIS-MAJ,3,"analyse primary
     historical evidence from a wide range of sources and in a variety of media
     and forms."
EHIS-MAJ,4,"interpret the past
     using a variety of theoretical and thematic approaches."
ELCO-MAJ,1,"apply systematic engineering design processes, including those aided by computer modelling and simulation, to analyse and design electronic, communication and signal processing systems and subsystems."
ELCO-MAJ,2,"evaluate solutions to engineering problems in electronic and communication systems, by selecting and applying theoretical principles and methods from mathematics, sciences, computing, electronics, communications, and signal processing."
ELCO-MAJ,3,"demonstrate proficiency with advanced knowledge and tools in electronic and communication systems, including analogue, digital and power electronics, microprocessors, power systems, digital signal processing, computer networks, and digital and wireless communications."
ELCO-MAJ,4,"identify and compare current developments and emerging trends in contemporary and prospective electronic and communication systems, such as cellular networks, embedded systems, and audio and acoustic systems."
ELCO-MAJ,5,use disciplinary knowledge and effective communication skills to critically appraise self and others' engineering designs and solutions.
ELCO-MAJ,6,undertake critical reflection and independent research in electronic and communication systems.
ELCO-MAJ,7,"work effectively and proactively within cross-cultural, multi-disciplinary teams, demonstrating autonomy, ethical conduct, well developed judgement, adaptability and responsibility to achieve engineering outcomes at a high standard."
ENGL-MAJ,1,"analyse texts by diverse authors and in different genres in several
 important fields of literary studies in English;"
ENGL-MAJ,2,"evaluate the historical and cultural contexts in which literature in
 English has been written and shaped;"
ENGL-MAJ,3,analyse literary texts in relation to these contexts;
ENGL-MAJ,4,"interpret, evaluate and make an argument about texts using appropriate
 written expression; and"
ENGL-MAJ,5,undertake further study within the discipline.
ENGS-MAJ,1,Update CMS roll-out
ENST-MAJ,1,"understand the dynamic relationships between social and environmental systems, processes and change;"
ENST-MAJ,2,"critically assess the impact and implications of social practices on the natural environment, and the effect of the natural environment on social practices, especially as these relate to commercial processes of natural resource production and consumption, governance and social inequalities more broadly;"
ENST-MAJ,3,"apply interdisciplinary approaches to address complex environmental challenges in a variety of contexts (e.g. climate change mitigation and adaptation, sustainability in economic development, rurality and regional planning, land care, public participation, wildlife conservation and cultural heritage);"
ENST-MAJ,4,"gather and analyse relevant social scientific and ecological data, as well as non-western perspectives, for creating adaptive and holistic responses to environmental issues; and"
ENST-MAJ,5,apply a range of conceptual frameworks and methodological approaches in conducting environmental research and formulating environmental policy strategies.
ENVS-MAJ,1,"Think critically about environmental science issues, integrate information, and construct logical, consistent and synthesised arguments."
ENVS-MAJ,2,"Explain the scientific underpinning and environmental implications of critical issues in ecological and landscape processes, across a range of likely scenarios."
ENVS-MAJ,3,"Engage with a range of stakeholders, including environmental scientists, land managers, government extension officers and private consultants, on a range of environmental and landscape issues."
ENVS-MAJ,4,Analyse and interpret complex processes and apply solutions across a range of environments and landscapes.
ESYS-MAJ,1,"Apply systematic design-oriented engineering principles, including those aided by mathematical modelling and computer simulation, to analyse and design environmental systems, including interacting chemical, ecological, water, and infrastructure systems."
ESYS-MAJ,2,"Evaluate solutions to engineering problems in environmental systems, by selecting and applying theoretical principles and methods from environmental science and engineering disciplines that describe the relationship between fundamental physical sciences and the behaviour of environmental systems and processes."
ESYS-MAJ,3,"Demonstrate proficiency with advanced knowledge and tools in environmental systems, including how water systems and water bodies interact with environmental systems and processes, how to compare and contrast methods for measuring, monitoring and modelling environmental systems and processes, and how to assess and manage environmental impacts."
ESYS-MAJ,4,"Identify and compare current developments and emerging trends in contemporary and prospective environmental systems, such as the social, ethical, legal and economic considerations when designing and building engineering systems that impact and are impacted by environmental systems and processes."
ESYS-MAJ,5,Use disciplinary knowledge and effective communication skills to critically appraise self and others' engineering designs and solutions.
ESYS-MAJ,6,Undertake critical reflection and independent research in environmental systems.
ESYS-MAJ,7,"Work effectively within teams, demonstrating autonomy, ethical conduct, well developed judgement, adaptability and responsibility to achieve engineering outcomes at a high standard."
EURO-MAJ,1,"analyse Europe as a cultural, geographical and political concept;"
EURO-MAJ,2,"assess the political, social, economic and cultural legacies of Europe's past;"
EURO-MAJ,3,explain the main challenges facing Europe and the EU at the beginning of the twenty-first century and into the future;
EURO-MAJ,4,"recognise and reflect on the relationships between European cultures, art and traditions, and the social and political history and institutions of contemporary Europe; and"
EURO-MAJ,5,evaluate recent developments in European cooperation and unity and contrast these to continuing cultural and political tensions.
FDAR-MAJ,1,"demonstrate sound knowledge of the technologies and techniques, processes, terminology, forms and materials of furniture making."
FDAR-MAJ,2,"develop and evaluate design concepts and processes by thinking creatively, critically and reflectively."
FDAR-MAJ,3,"respond
 to the demands of a project, either independently or collaboratively, 
by applying skills and knowledge to the design, visualisation and making
 of creative works."
FDAR-MAJ,4,"interpret, communicate and present ideas, problems and arguments in modes suited to a range of audiences."
FDAR-MAJ,5,"recognise
 and reflect on social, ethical, cultural, technological, and 
environmental issues of creative practice and design considering local 
and international perspectives."
FDAR-MAJ,6,identify and apply occupational health and safety principles within a workshop environment.
FINM-MAJ,0,nil
FREN-MAJ,1,communicate proficiently and confidently in French;
FREN-MAJ,2,identify the structure and uses of French;
FREN-MAJ,3,"demonstrate an understanding of the societies and cultures of France and the Francophone world, and their socio-historical contexts;"
FREN-MAJ,4,"construct a schema of the connections between France and its geographical, social and cultural origins; and"
FREN-MAJ,5,recognise the importance of intercultural communication.
GDAR-MAJ,1,"demonstrate sound knowledge of the technologies and techniques, processes, terminology, forms and materials of glass practice."
GDAR-MAJ,2,"develop and evaluate design concepts and processes by thinking creatively, critically and reflectively."
GDAR-MAJ,3,"respond
 to the demands of a project, either independently or collaboratively, 
by applying skills and knowledge to the design, visualisation and making
 of creative works."
GDAR-MAJ,4,"interpret, communicate and present ideas, problems and arguments in modes suited to a range of audiences."
GDAR-MAJ,5,"recognise
 and reflect on social, ethical, cultural, technological, and 
environmental issues of creative practice and design considering local 
and international perspectives."
GDAR-MAJ,6,identify and apply occupational health and safety principles within a workshop environment.
GEND-MAJ,1,"analyse, evaluate and apply contemporary theories of gender, sexuality, culture;"
GEND-MAJ,2,use the conceptual vocabulary of gender and cultural studies to analyse contemporary issues and problems;
GEND-MAJ,3,"use the methods of gender and cultural studies to analyse the way gender and sexuality are produced in culture, including written and visual texts;"
GEND-MAJ,4,"identify and understand interdisciplinary approaches to gender, sexuality and culture;"
GEND-MAJ,5,communicate complex ideas in speech and writing; and
GEND-MAJ,6,"reflect critically on the knowledge and skills developed in their study of Gender, Sexuality and Culture."
GEOG-MAJ,1,Evaluate current geographic approaches to investigating a range of environment and sustainability issues and management strategies in international and Australian contexts.
GEOG-MAJ,2,Integrate knowledge relevant to geographical science and policy across disciplines.
GEOG-MAJ,3,"Apply a range of written, oral and visual communication skills to effectively convey and discuss information about geographical science and policy in multidisciplinary contexts, and"
GEOG-MAJ,4,"Engage with current environment and sustainability policy debates, recognising the socio-political and cultural contexts in which they occur."
GERM-MAJ,1,"express viewpoints and develop arguments confidently in German, incorporating some complex sentence structures. Students can expect to achieve approximately the B2 level or higher of the CEFR (Common European Framework of Reference for Languages);"
GERM-MAJ,2,"use the language for academic purposes, e.g. essay writing with referencing, class presentations, and research related to the German language and associated cultures;"
GERM-MAJ,3,"read, understand, and analyse German literary texts, films, and a range of print, visual and digital media in the context of German-speaking cultures;"
GERM-MAJ,4,demonstrate an understanding of the modern history of the German-speaking countries; and
GERM-MAJ,5,demonstrate intercultural awareness.
GSDA-MAJ,1,"demonstrate
 sound knowledge of the technologies and techniques, processes, 
terminology, forms and materials of gold & silversmithing practice."
GSDA-MAJ,2,"develop and evaluate design concepts and processes by thinking creatively, critically and reflectively."
GSDA-MAJ,3,"respond
 to the demands of a project, either independently or collaboratively, 
by applying skills and knowledge to the design, visualisation and making
 of creative works."
GSDA-MAJ,4,"interpret, communicate and present ideas, problems and arguments in modes suited to a range of audiences."
GSDA-MAJ,5,"recognise
 and reflect on social, ethical, cultural, technological, and 
environmental issues of creative practice and design considering local 
and international perspectives."
GSDA-MAJ,6,identify and apply occupational health and safety principles within a workshop environment.
GSEC-MAJ,0,nil
HBIO-MAJ,1,Apply their conceptual knowledge of biological principles and processes to the study of human health and disease.
HBIO-MAJ,2,"Solve problems and critically analyse issues using interdisciplinary approaches to the study of human structure and function at molecular, cellular, and systems levels."
HBIO-MAJ,3,"Explain how biology is an evidence-based discipline involving observation, experimentation and hypothesis testing and how it relates to other scientific disciplines."
HBIO-MAJ,4,Develop and implement experimental strategies to investigate different biological and experimental systems and analyse and present results of these investigations.
HBIO-MAJ,5,"Critically assess biological information and apply it to theoretical, experimental and professional contexts."
HBIO-MAJ,6,"Employ their collaborative and independent educational experiences of laboratory, project and course work in other contexts."
HBIO-MAJ,7,Clearly communicate biological processes and principles to both science literate and non-science literate audiences.
HBIO-MAJ,8,"Recognise how biology contributes to resolving ethical, social, medical and environmental issues and the expectations this places on their professional practice."
HCCC-MAJ,1,Identify and describe contemporary issues and challenges in human-centred and creative computing
HCCC-MAJ,2,Synthesise knowledge of human-centred and creative computing systems and their social context to address problems
HCCC-MAJ,3,Design and develop human-centred and creative technologies
HCCC-MAJ,4,Apply theoretical frameworks and research techniques to evaluate and critique human-centred and creative computing systems
HIND-MAJ,1,Demonstrate an understanding of how the Indian cultural traditions of Hindi speakers impact communication in Hindi and the ways in which the language and culture are linked in discourse in Hindi.
HIND-MAJ,2,Write in Hindi with a full understanding of Hindi grammar and the ways in which different genres of Hindi use different registers of vocabulary drawn from diverse sources.
HIND-MAJ,3,"Engage with media, such as spoken word broadcasts, television and the cinema and analyse the contents and speak and discuss with others their understandings of Hindi media."
HIND-MAJ,4,"Read, understand and discuss Hindi texts such as newspapers, magazines, and modern Hindi literary texts."
HIND-MAJ,5,Express themselves confidently in spoken and written Hindi in informal and formal registers of the language that reflect Hindi's shared heritage of vocabularies drawn from Sanskrit and Urdu.
HIST-MAJ,1,demonstrate understanding of multiple periods or cultures of the past;
HIST-MAJ,2,demonstrate understanding of key conceptual approaches to interpreting the past;
HIST-MAJ,3,"examine historical issues by undertaking research, and analysing evidence, according to the methodological and ethical conventions of the discipline;"
HIST-MAJ,4,"construct an evidence-based argument or narrative in audio, digital, oral, visual or written form; and"
HIST-MAJ,5,identify and reflect critically on the knowledge and skills developed in their study of History and their relationship to the contemporary world.
HMRT-MAJ,1,"identify, discuss and analyse the key moments, issues and debates in the emergence of the contested concept of human rights;"
HMRT-MAJ,2,"identify and appraise the differing applications
  of human rights in theory, law and practice;"
HMRT-MAJ,3,"explain and assess the major contemporary
  theoretical debates within the human rights discourse; and"
HMRT-MAJ,4,recognise and assess the intersection between theories of human rights and the application of human rights standards in practice.
HUEB-MAJ,1,"explain the processes of natural selection, adaptation and speciation that underpin the evolution of animals and humans;"
HUEB-MAJ,2,"explain the characteristics of humans, including intelligence, language, culture, morphology and behaviour, and place those in the context of our place in the animal kingdom;"
HUEB-MAJ,3,interpret and discuss hypotheses as to how and why uniquely human adaptations initially evolve; and
HUEB-MAJ,4,critically evaluate and propose hypotheses about the future directions of human evolution on the basis of existing evolutionary theory and the selective factors acting on humans.
ICOM-MAJ,1,"demonstrate an understanding of the nature of the complex and multifaceted relations between communication, culture, language and identity;"
ICOM-MAJ,2,"demonstrate an understanding of the limits of translatability of key concepts across languages, and the implications of these limits for international communication;"
ICOM-MAJ,3,"analyse cultural assumptions underlying expressions such as â€œthe ideals of freedom, democracy, and the rule of laws (Obama 2006: p. 284) and explain their linguistic underpinnings;"
ICOM-MAJ,4,explain the sources of miscommunication between speakers of different linguistic and cultural backgrounds who communicate using English as a lingua franca;
ICOM-MAJ,5,demonstrate an understanding of potential sources of miscommunication within multilingual and multi-cultural societies such as Australia; and
ICOM-MAJ,6,communicate effectively in another language in many contexts and understand the issues that can arise in international communication due to linguistic differences.
INDN-MAJ,1,Recogniseand produce the full set of standard Indonesian phonemes and use patterns ofstress and intonation.
INDN-MAJ,2,"Recogniseand produce phrase and sentence structures that enable them to converse andwrite extended passages on a wide range of non-technical topics, and to read arange of authentic print media texts with sparing use of a dictionary."
INDN-MAJ,3,Use anactive vocabulary of around 2500 words.
INDN-MAJ,4,"Converse andwrite on a wide range of everyday topics as well as in contexts such asdiscussion of marriage laws, forest conservation, urbanisation, languagepolitics, and economic disparity."
INDN-MAJ,5,"Demonstratea cultural understanding of Indonesian perceptions or practices regarding suchtopics as: de facto relationships, punishment for drug offences, internalmigration, language prestige and language choice, and working abroad."
INDS-MAJ,1,Understand and evaluate historical and current events and developments that have shaped the South Asian subcontinent and contemporary India.
INDS-MAJ,2,Identify and critique the contemporary socio-cultural and political systems of India.
INDS-MAJ,3,Analyse the global significance of events and developments in India and across the region.
INDS-MAJ,4,Understand the processes and disciplinary approaches through which current knowledge about Indian and South Asian Studies has developed.
INDS-MAJ,5,Effectively argue and communicate about issues of regional cooperation and unity in the context of tensions in and among South Asia's diverse traditions.
INFS-MAJ,0,nil
,0,nil
INSC-MAJ,0,nil
INST-MAJ,1,"Understand and evaluate historical and current events and developments that have shaped Indonesia,"
INST-MAJ,2,"Identify and critique the contemporary socio-cultural and political systems of Indonesia,"
INST-MAJ,3,"Analyse developments in Indonesia in their regional and global contexts,"
INST-MAJ,4,Understand the processes and disciplinary approaches through which current knowledge about Indonesian studies has developed.
INSY-MAJ,0,nil
INTB-MAJ,1,"Review, analyse, consolidate and synthesise international business knowledge;"
INTB-MAJ,2,Demonstrate a broad understanding of international business knowledge with depth in some areas;
INTB-MAJ,3,Exercise critical thinking and judgement in identifying and solving problems with intellectual independence;
INTB-MAJ,4,"Present a clear, coherent and independent exposition of international business knowledge and ideas."
IREL-MAJ,1,identify the core concepts and theories that dominate global politics in the 21st century;
IREL-MAJ,2,have a thorough understanding of the historical development of the global system;
IREL-MAJ,3,examine the contemporary challenges facing the global system and evaluate the policies implemented to address them;
IREL-MAJ,4,"identify the role that people, states, ideas, and institutions play in shaping the international political economy;"
IREL-MAJ,5,understand Australia's role in global politics; and
IREL-MAJ,6,reflect critically on the knowledge and skills developed in their study of International Relations.
ISCK-MAJ,1,"Demonstrate an understanding of Australian and global Indigenous history and culture, policies pertaining to Indigenous peoples, and the application of Indigenous knowledges in a scientific context."
ISCK-MAJ,2,Demonstrate an understanding of the importance of protocols for protecting Indigenous knowledges in the sciences and how to build these into project and research design.
