Course_Code,Course_Name,URL,Last_Assessed,Last_Published,Note,Prerequisite_Courses,Prerequisite_Units,TD_Interactive,TD_Interactive_Written,TD_Context,TD_Context_Written,TD_Integrative,TD_Integrative_Written,TD_Pluralistic,TD_Pluralistic_Written,TD_Change,TD_Change_Written,TD_Systemic,TD_Systemic_Written,Advice,Assessment URL
LING2029,Language Assessment,https://cms.anu.edu.au/cms/design/course/70951/view,17-Jul-24,03-Jul-24,,Open to students with relevant backgrounds,Normally completed at least 48 units,Somewhat Likely (Common),"Assessment: Engagement tasks, for example quizzes, forum discussions and presentations",Likely,"LO: critically evaluate the role of language and assessment practices in specific policy contexts;
Description: Starting from the concept of  a language , this course explores the complex relationships between language use, language acquisition, and mechanisms, such as policies, standardized tests and assessment processes.",,,,,Somewhat Likely,"LO: enabling them to make informed connections between government or institutional policies, their instruments and the sociopolitical priorities that drive them",,,,
LING2034,Communication in Health Care,https://cms.anu.edu.au/cms/design/course/70952/view,17-Jul-24,03-Jul-24,,Open to all students,Normally completed at least 48 units,Somewhat Likely (Common),"Assessment: Class Participation; Padlet participation
Description: Students will engage in discussion with their peers during class group work and provide peer feedback on select assessment tasks.",Somewhat Likely,"Description: A growing body of evidence has demonstrated that ineffective communication at all levels of the healthcare system leads to poor patient outcomes, including serious illness and death, clinician dissatisfaction, and inefficiencies in the health system.",Highly Likely,"Description: In this course we introduce students to this relatively new field of healthcare communication research, accumulatively building up their qualitative and mixed methods research skills to undertake their own research project in this area. ",,,Likely,"LO: demonstrate an understanding of the processes of translating evidence based research into communication frameworks, protocols and training to improve practice",,,,
MATH2306,Applied Mathematics II,https://cms.anu.edu.au/cms/design/course/5863/view,20-Jul-24,26-Oct-18,,Open to students with particular courses,Normally completed at least 72 units,Somewhat Likely (Material),"Assessment: This course will be useful for majors in economics, mathematical finance, engineering and physics",Somewhat Likely,"LO:  Apply problem-solving using Fourier series, complex analysis and integral transform techniques applied to diverse situations in physics, engineering and other mathematical contexts.
Description: This course will be useful for majors in economics, mathematical finance, engineering and physics. We will illustrate the theory with examples from these disciplines.",LIkely,"Description: 
In physics, economics and engineering, we frequently encounter quantities (for example energy) that depend on many variables (such as position, velocity, temperature). ",,,,,,,,
MATH2307,Bioinformatics and Biological Modelling,https://cms.anu.edu.au/cms/design/course/68105/view,20-Jul-24,10-Apr-24,,Open to students with relevant backgrounds,Normally completed at least 48 units,Somewhat Likely (Material),"Description: The course begins with a detailed discussion of sequence alignment algorithms that are critical for assessing the relatedness of DNA, RNA and amino acid sequences.
LO:  Understand basic models for the evolution and comparison of biological sequences.",Somewhat Likely,"Description: a broad range of examples of applications of mathematics in biology, both at the molecular and macroscopic level, will be given",,,Somewhat Likely,"LO: a broad range of examples of applications of mathematics in biology, both at the molecular and macroscopic level, will be given",,,,,,
MATH3015,Stochastic Analysis with Financial Applications,https://cms.anu.edu.au/cms/design/course/68123/view,20-Jul-24,10-Apr-24,,Open to students with particular courses,Normally completed at least 96 units,Somewhat Likely (Material),LO: Explain the core mathematical tools and fundamental concepts of modern financial mathematics,Not Likely,"Description: This course gives a rigorous mathematical introduction to stochastic processes, stochastic differential equations, and their applications in finance",Somewhat LIkely,Description: Stochastic Analysis with Financial Applications provides an accessible but mathematically rigorous introduction to financial mathematics and quantitative finance. ,,,,,,,,
MATH3353,Mathematical Bioinformatics,https://cms.anu.edu.au/cms/design/course/31821/view,20-Jul-24,16-Apr-24,,Open to students with particular courses,Normally completed at least 96 units,Somewhat Likely (Material),"Description: This course begins with a brief review of some of the areas of probability and statistics needed for applications to bioinformatics problems.  
LO:  Demonstrate accurate and efficient use of specific bioinformatics techniques.",Not Likely,Description: give examples of current research.,Likely,"Description: There are four assignments in total, each testing students' understanding and ability to apply the mathematical reasoning behind the four major topics covered in the course to real problems in bioinformatics.",,,,,,,,
MEDN2222,Exquisite Corpse - Insight into the Human Body,https://programsandcourses.anu.edu.au/course/MEDN2222,18-Jun-24,15-Dec-23,,Open to students with relevant backgrounds,Normally completed at least 24 units,Likely (Experts),"Description: Sessions are delivered at the School of Medicine and Psychology anatomy facility and the School of Art and Design, Foundation Studies studios.
LO: Collaborate effectively to solve problems and achieve common goals.",Somewhat Likely,"Description: The aim of this course is to provide an introduction to anatomy through visual arts, using an integrated approach
LO: Demonstrate original exploration of visual arts materials and process in the context of anatomical studies.",Highly Likely,"Description: The aim of this course is to provide an introduction to anatomy through visual arts, using an integrated approach.
Description:  The course will be co-taught by academics in the College of Arts and Social Sciences and The College of Health and Medicine. [...] A peer mentoring process will be established between science students with a background in anatomy and visual art students.",,,,,,,,https://anu365.sharepoint.com/:f:/r/sites/AcademicPortfolioInitiatives/Shared%20Documents/Curriculum%20Reform/Curriculum%20Updates/TD%20Course%20List%20Assessments?csf=1&web=1&e=eApdfk
MGMT3015,Corporate Strategy,https://cms.anu.edu.au/cms/design/course/56928/view,17-Jul-24,31-Oct-22,,Open to all students,Normally completed at least 48 units,Highly Likely,"Assessment: Client Focused Presentation (30%)
Activity: Tutorial case study",Somewhat Likely,"Description: choice of strategy at functional, business, corporate and global levels",,,,,Likely,"LO: Formulate appropriate strategies to gain a competitive advantage at both business and corporate levels;
Description: Topics include external analysis of opportunities and threats, internal analysis of capabilities and competencies, choice of strategy at functional, business, corporate and global levels, alignment of structures and controls with strategies and evaluation of strategies. ",,,,
MGMT3025,International Human Resource Management,https://cms.anu.edu.au/cms/design/course/56598/view,17-Jul-24,31-Oct-22,,Open to students with particular courses,Normally completed at least 48 units,Highly Likely,"Assessment: Literature Review Description - The seminars in the first half of the semester will feature guest speakers and case analyse
Assessment: Case Presentation (Group Assignment) (20%)",Likely,"LO: Demonstrate an understanding of the strategic and functional roles of HRM in various international contexts, specially in areas such as recruitment and selection, performance management, training, learning and development, career management, compensation, motivation and repatriation;
LO: Develop competency in dealing with cross cultural situations;",,,,,Likely,"LO: Demonstrate an understanding of the external forces (e.g. globalisation, sociocultural changes, political and economic changes) that have the potential to shape international HRM; and",,,,
MGMT3027,Entrepreneurship Innovation,https://cms.anu.edu.au/cms/design/course/62622/view,17-Jul-24,29-Jun-23,,Open to all students,Normally completed at least 72 units,Highly Likely,"LO: Work effectively in multidisciplinary, cross-cultural teams, communicating, negotiating and contributing shared contributions towards the development of a team project.",Somewhat Likely,"Description:  And in the public sector, the need for effective policies to deal with new challenges and for increasing service delivery with declining budgets also places a premium on innovative thinking
LO: Define, explain and illustrate theories of business innovation and entrepreneurship, the evolution of industries and economies, and the roles of entrepreneurs;",,,,,Likely,"LO: Develop a comprehensive and well structured business plan for a new venture
Description: The course focuses on the skills necessary for the planning, development and launch of entrepreneurial and innovative ventures. ",,,,
MUSI2235,Critical Music Studies,https://cms.anu.edu.au/cms/design/course/71145/view,17-Jul-24,17-Jun-24,,Open to all students,Normally completed at least 36 units,Likely (Peers),"Assessment: Group presentation, 15 minutes - equivalent to 1800 words",Likely,"LO: critically analyse and discuss different forms of music research in cultural and other contexts, and their methods of identifying and addressing musical problems;
Description: In relation to each of these fields, the course highlights core foundational theories and practices, placing them in their historical and cultural context:",Somewhat Likely,Description: The development of these foundational research skills offers essential problem solving and critical analytical tools for developing a musical research practice,Somewhat Likely,"Description: Finally, we ask what roles can practice-based research play in developing our understanding of the internal workings of music creation, production, performance, and reception.",,,,,,
MUSI2236,Music and Globalisation,https://cms.anu.edu.au/cms/design/course/71141/view,17-Jul-24,03-Jul-24,,Open to all students,Normally completed at least 36 units,Likely (Peers),"Assessment: 
Group Map Presentation",Likely,"Description: This course examines the impact of globalisation on local musical practices, exploring how music plays an essential role in articulating identity and place, how music developed into a commodity that is bought and sold, and how music remains a crucial factor in cultural survival throughout our globalised world.
LO: demonstrate listening skills focused on cross-cultural musical elements, developed through the critical study and discussion of selected works;",Likely,"Description: demonstrate research, critical analysis, discussion and writing skills about the discourses surrounding the globalisation of music.",,,,,,,,
MUSI3309,Music and Digital Media,https://cms.anu.edu.au/cms/design/course/71142/view,17-Jul-24,03-Jul-24,,Open to all students,Normally completed at least 72 units,Likely (Peers),Assessment: Group presentation ,Likely,"Description: 
Music and Digital Media is an interdisciplinary course focusing on the business, cultural context, and scientific nature of the [inter]relationship between music and media",,,Likely,"LO: research, critically analyse, and debate current issues/problems surrounding music and digital media from a variety of interdisciplinary perspectives.",Somewhat Likely,Description:  Such is the evolutionary nature of music in the digital age that the issues and problems addressed in this course will vary from year to year,,,,
MUSI3317,Popular Music Studies,https://cms.anu.edu.au/cms/design/course/71163/view,17-Jul-24,03-Jul-24,,Open to all students,Normally completed at least 72 units,Likely (Peers),Assessment: Group Research Presentation,Likely,"Description: This course examines the political significance of popular music through a variety of cultural and contextual lens, such as aesthetics, textual analysis, race, gender, sexuality and materiality",Likely,"LO: interpret and problematise the interrelationships between popular music, culture and politics from several theoretical perspectives in popular music studies; ",,,Somewhat Likely,"Description: Popular music and politics are inextricably linked. In just a few decades, popular music has formed new cultural spaces, influenced politics and policy and empowered minority groups.",,,,
MUSI3328,Music Practice as Research,https://cms.anu.edu.au/cms/design/course/71144/view,17-Jul-24,25-Jun-24,,Open to students with particular courses,Normally completed at least 96 units,Likely (Peers),"Description:  Students will work individually and on group projects to explore theories and methods underpinning music practice research, drawing on written work, exegeses, creative outputs, and case studies.
Assessment: Group Research Presentation, 15 minutes - equivalent of 1800 words",Somewhat Likely,"LO: position musical practice in a research context
Description: This course encourages music students to position their artistic practice in a research context which is focused on the discovery of musical problems",Likely,"LO: critically analyse and discuss a range of theories and methods relevant to practice research.
Description: This course encourages music students to position their artistic practice in a research context which is focused on the discovery of musical problems, the framing of research questions, the planning and execution of research projects, and the dissemination of research findings/results.",,,,,,,,
PASI2001,Pacific Studies in a Globalising World,https://programsandcourses.anu.edu.au/course/PASI2001,18-Jun-24,01-Jul-24,,Open to all students,Completed minimum of 24 units,Likely (Experts),"LO: Facilitate and lead discussions on contemporary Pacific issues with peers.
LO: Research and present group-based work on Pacific culture, heritage, arts, sports, politics, activism, media or environmental issues.
Assessment: Leading tutorial discussion, Group research project and presentation",Highly Likely,"Description: It emphasizes the complexity, diversity, creativity, and sovereignty of the region. Indigenous Pacific Islander approaches to engaging and learning with and from Oceania, including through dance, poetry, music, fashion and film, are particularly highlighted. 
LO: Demonstrate an understanding of the histories and global forces that have shaped the contemporary Pacific region.",Highly Likely,"Description: This course introduces students to the histories, key terms and approaches shaping the dynamic, transdisciplinary field of Pacific Studies.
LO: Describe and comprehend the nature of interdisciplinary and transdisciplinary Pacific Studies in comparison with single-disciplinary approaches.
LO: Research and present group-based work on Pacific culture, heritage, arts, sports, politics, activism, media or environmental issues.",,,,,,,,https://anu365.sharepoint.com/:f:/r/sites/AcademicPortfolioInitiatives/Shared%20Documents/Curriculum%20Reform/Curriculum%20Updates/TD%20Course%20List%20Assessments?csf=1&web=1&e=eApdfk
PHYS2205,Physics for Future Leaders,https://cms.anu.edu.au/cms/design/course/65555/view,20-Jul-24,08-Feb-24,,Open to all students,Normally completed at least 24 units,Somewhat Likely (Broad),"Description: Non-physics students: to teach them about how physics can help them make the world a better place. Physics students: to teach them about how their physics knowledge can be applied to make the world a better place.
Assessment: Tests, assignments and groupwork, done during the workshops.",Likely (Experts),"Description: It will also cover the social, economic and political context in which physics is used, and how scientists can most effectively deal with these big-picture issues.",,,,,Likely,"Description: It will also cover the social, economic and political context in which physics is used, and how scientists can most effectively deal with these big-picture issues.",,,,
PNPI1001,"Introduction to Philosophy, Neuroscience, and Psychology",https://cms.anu.edu.au/cms/design/course/57146/view,17-Jul-24,29-Nov-24,,Open to students with relevant backgrounds,No prerequisite units,Somewhat Likely (Material),"Description: 
What is a mind? How do brains give rise to thoughts, feelings, and conscious experiences? And how can different research traditions interact fruitfully to help explore one of the last great mysteries?
NOTE: class summary not created yet",Likely,"Description: It will also expose students to different views about the relationship between the component fields, covering basic topics in scientific inquiry, levels of analysis, and different descriptive perspectives.",Likely,LO: Apply discipline-specific skills from all three disciplines to transdisciplinary research.,Likely,"Description: It will introduce students to the promise and challenges of studying the mind from multiple disciplinary perspectives, giving students access to the basic vocabulary, methods, and constructs of the three component fields.
LO: Understand core topics at the intersection of philosophy, neuroscience, and psychology.",,,,,,https://anu365.sharepoint.com/:f:/r/sites/AcademicPortfolioInitiatives/Shared%20Documents/Curriculum%20Reform/Curriculum%20Updates/TD%20Course%20List%20Assessments?csf=1&web=1&e=eApdfk
PNPI2001,"Topics in Philosophy, Neuroscience, and Psychology",https://cms.anu.edu.au/cms/design/course/67930/view,17-Jul-24,,,Open to students with particular courses,Normally completed at least 48 units,Likely (Experts),"Description: The course will cover a single topic each year from the perspective of philosophy, neuroscience, and psychology, with teaching input from staff and visitors to the three cognate disciplines",Likely,"Description: To understand phenomena like memory, consciousness, bodily sensations, or  navigation, we must approach them from multiple disciplinary perspectives.",Likely,LO: Apply discipline-specific skills to transdisciplinary research in both laboratory and written settings. ,Likely,"Description: Each year's topic will be the focus of transdisciplinary inquiry, focusing on how methods in one discipline can be used to make progress in the questions of another
LO: Examine a core topic at the intersection of philosophy, neuroscience, and psychology.",,,,,,https://anu365.sharepoint.com/:f:/r/sites/AcademicPortfolioInitiatives/Shared%20Documents/Curriculum%20Reform/Curriculum%20Updates/TD%20Course%20List%20Assessments?csf=1&web=1&e=eApdfk
PNPI3001,"Research Project in Philosophy, Neuroscience, and Psychology",https://cms.anu.edu.au/cms/design/course/67931/view,17-Jul-24,,,Open to students with particular courses,Normally completed at least 96 units,Likely (Peers),"Assessment: Group presentation on project
Description: The group presentation will give students an opportunity to defend and critique the concepts used in their proposal. The final summary paper will present and defend the results of the undertaken research.",Somewhat Likely,"Unclear from course description
Description: Students will learn to take a transdisciplinary approach to real research problems",Likely,LO: Design and develop an independent and sustained investigation on a chosen transdisciplinary research topic. ,LIkely,"Description: Students will learn to take a transdisciplinary approach to real research problems, including critical assessment and evaluation in the context of current knowledge and frameworks.",,,,,,https://anu365.sharepoint.com/:f:/r/sites/AcademicPortfolioInitiatives/Shared%20Documents/Curriculum%20Reform/Curriculum%20Updates/TD%20Course%20List%20Assessments?csf=1&web=1&e=eApdfk
PPEI1001,PPE Integration 1,https://cms.anu.edu.au/cms/design/course/70506/view,17-Jul-24,21-Jun-24,,Open to students with relevant backgrounds,No prerequisite units,Likely (Peers),LO: work collaboratively to apply the skills learned on the course to new and complex real-world problems.,Somewhat Likely,LO: think about and discuss puzzles in the social sciences using the tools of PPE,Likely,"LO: demonstrate a working knowledge of key terms, concepts and ideas in the study of PPE",Likely,"Description: 
Each week the students will be set an issue that is a problem or problem in politics, philosophy or economics.",,,,,,
PPEI2001,PPE Integration 2,https://cms.anu.edu.au/cms/design/course/70507/view,17-Jul-24,21-Jun-24,,Open to students with relevant backgrounds,Normally completed at least 42 units,Somewhat Likely (Material),"For example, topics covered",Likely,"Description: Topics such as global warming (and environmental issues more generally), inequality, dealing with risk and uncertainty, and commodification will be used to examine and contrast what philosophers and economists have said about the issues and attempt an intellectually respectable synthesis. ",Likely,"LO: demonstrate a working knowledge of key terms, concepts, and ideas in the study of PPE",Likely,"Description: In each case, the role of 'political elements' will be an important part of the story both substantively, in terms of what the expected role of political institutions might be and what political constraints may be relevant; and conceptually, in terms of the different understanding of political process that philosophers and economists tend to have.",,,,,,
PPEI3001,"PPE Integration 3: Classic Literature in Politics, Philosophy and Economics",https://cms.anu.edu.au/cms/design/course/70323/view,17-Jul-24,02-Jul-24,,Open to students with particular courses,Normally completed at least 96 units,Somewhat Likely (Broad),Activities: Students will be assessed on their ability to respond to the weekly discussion questions for the primary source readings posted on Wattle and their ability to respond thoughtfully to contributions by their peers,Likely,"Description:  At every stage, the course places developments in the field into political and social context and presents alternative sets of ideas and paths not taken that were once prominent but have since been forgotten.",,,,,Likely,"Description: Where did economics come from and how did it assume its current form? This is the fundamental question that this course seeks to investigate by integrating philosophy, politics, and economics through historical analysis",,,,
PSYC1005,The Wellbeing Formula,https://cms.anu.edu.au/cms/design/course/67831/view,17-Jul-24,13-Mar-24,,Open to all students,No prerequisite units,Likely (Experts),Activities: Guest lecture series,Likely,"LO: Understand the key sociocultural factors contributing to wellbeing;
Description: In addition to its focus on psychological factors, the course will address sociocultural factors in terms of the societal determinants of wellbeing and how to build flourishing communities and societies",Likely,LO: Critique the wellbeing literature in terms of its current limitations so as to understand fruitful directions for future research,,,,,,,,
PSYC2007,Biological Basis of Behaviour,https://cms.anu.edu.au/cms/design/course/63564/view,17-Jul-24,22-Nov-23,,Open to students with particular courses,Normally completed at least 48 units,Somewhat Likely (Broad),Assessment: Laboratory participation. Students will be assessed on the amount of and quality of their involvement in discussion in the laboratory classes. Being able to interact with others and discuss scientific concepts is an important skill and one that is relevant to many potential employers.,Not Likely,"Narrow context discussed in description:  In this course we will look at the workings of the brain, with particular focus on understanding aspects of brain function that are of particular importance to psychology.",Likely,"LO: Compare and contrast particular approaches to studying brain function with respect to their use to answer a particular research question.
Description: . Consequently, this course focus on the link between neuroscience and psychological functioning.
LO: Explain the link between psychological and brain functioning.",,,,,,,,
PSYC2011,Introduction to Forensic and Criminal Psychology,https://cms.anu.edu.au/cms/design/course/58823/view,17-Jul-24,31-Oct-23,,Open to students with relevant backgrounds,Normally completed at least 48 units,Somewhat Likely (Material),"LO: Describe key concepts
in psychology and the law and the theories and the methods used to address
these.",Likely,"LO: major areas of psychology and law, including (but not limited to) psychology of forensic science, lie detection, interrogations and confessions, eyewitness memory, jury decision making, mental health law, and the psychology of specific types of criminal offender",Likely,LO: Think critically about the interactive relationship between psychology and the law.,,,Somewhat Likely,"Description: e text will provide the student with a broad understanding of the impact that psychology can have on any one individual within the criminal justice system, as well as the impact that psychology can have on the legal system itself.",,,,
