Course_Code,Course_Name,URL,Last_Assessed,Last_Published,Note,Prerequisite_Courses,Prerequisite_Units,TD_Interactive,TD_Interactive_Written,TD_Context,TD_Context_Written,TD_Integrative,TD_Integrative_Written,TD_Pluralistic,TD_Pluralistic_Written,TD_Change,TD_Change_Written,TD_Systemic,TD_Systemic_Written,Advice,Assessment URL
ACST3032,Actuarial Data Analysis,https://programsandcourses.anu.edu.au/course/ACST3032,15-Jul-24,05-Sep-23,,Open to students with particular courses,Normally completed at least 96 units,Somewhat Likely (Material),LO: Explain where and how their analytical work can add value to the business environment and strategy.,Likely,"Description: ...aims to teach students how to apply this knowledge in real-life business settings, preparing them for more complex and practice specific applications",,,,,,,,,,
ANTH2130,Violence and Terror,https://programsandcourses.anu.edu.au/course/ANTH2130,18-Jun-24,02-Jul-24,Updated for TD-GA,Open to students with relevant backgrounds,Normally completed at least 48 units,Likely (Peers),"Description: This course emphasises active and collaborative learning, with teamwork comprising 60% of the assessment. Students will be expected to seriously engage with the weekly learning materials before coming to class, undertake preparatory work with their teammates, and be primed to create an active and lively learning environment each week.
Assessment: Team project, consultation, contribution (60%)
LO: co-operate with fellow students and team members to promote effective peer learning, teamwork, organization, project development, and ability to adhere to time-on-task principles;
LO: develop interpersonal skills including social intelligence, open-mindedness, reliability, mutual respect and responsibility, and capacity to use diversity within the team as a resource",Likely,"Description: Anthropological perspectives on violence consider how social life is shaped through different forms of engagement with force and intimidation, and foreground concerns of meaning, representation and symbolism
LO: apply the core language and key concepts of the anthropology of violence to real life case studies, thus producing a critical analysis of practices and discourses of violence and terror",Highly Likely,"Description [Integrative]: In this course, we will be approaching violence as usually meaningful and always culturally mediated: a phenomenon that is not outside the realm of human society.",,,,,,,,ANTH2130.pdf
ARTV3035,Creative Research Practice: Extending and Consolidating an Independent Project,https://programsandcourses.anu.edu.au/course/ARTV3035,18-Jun-24,01-Jul-24,Updated for TD-GA,Open to students with relevant backgrounds,Normally completed at least 96 units,Likely (Peers),"Description: This course provides a cross-disciplinary forum for critical and contextual discussions relevant to contemporary creative practices, supported through tutorials and discussions within discipline areas.",Likely,"LO: demonstrate a comprehensive awareness of the social, ethical, cultural, technological and environmental issues of creative practice, considering local and international perspectives.",Somewhat Likely,"LO: employ conceptual and technical experimentation, critical and reflective thinking to develop and create new works",,,,,,,,ARTV3035.pdf
ASIA2118,Pollution in Past Societies,https://programsandcourses.anu.edu.au/course/ASIA2118,15-Jul-24,30-Jan-24,,Open to all students,Normally completed at least 48 units,Somewhat Likely (Broad),"Description: The course will consist of a mix of lectures (concepts, theories), discussion of case-studies to be presented by students, and practical exercises that will be given during the lectures",Highly Likely,"LO: Identify specific categories of pollution resulting from historical human activities.
LO: Analyse the correlation between the historical evolution of societies and the emergence of pollution.",Likely,LO: Analyse the correlation between the historical evolution of societies and the emergence of pollution.,Likely,"Description: Upon completion of this course, students will have built a strong foundation in environmental history, achieved through an engaging exploration that bridges history and science, contributing to the betterment of our environment's future.",,,,,,
ASIA2302,Culture and Modernity in Asia,https://programsandcourses.anu.edu.au/course/ASIA2302,15-Jul-24,08-Jul-24,,Open to all students,Normally completed at least 24 units,Somewhat Likely (Material),"LO: Summarise, digest and present the contents of analytical readings for a wider audience.",Highly Likely,"Description: Relevant themes that have attracted anthropological interest include changing traditions and popular culture, adaptive custom and cosmopolitanism, migration and citizenship, identity politics and social movements as well as distinctive and emergent forms of governance in both collective and self-cultivating forms of expression. ",Likely,Description: Drawing on a rich corpus of social theory and ethnographic research [...] the course will provide students with conceptual and analytical tools [...] to review and appreciate the key anthropological debates and influential works in the study of modernity,Likely,LO: Demonstrate understanding of theories and debates around modernity and concepts of culture.,Likely,"LO: Demonstrate knowledge of key concepts in anthropology and its central research method - ethnography
LO: Critically utilise case studies and relevant source material when arguing analytical points in writing.",,,,
ASIA2308,Linguistic histories in Asia and the Pacific,https://programsandcourses.anu.edu.au/course/ASIA2308,18-Jun-24,09-Feb-24,,Open to all students,Completed minimum of  24 units,Somewhat Likely (Material),"Class Activity: Case study approach
LO: Understand the contemporary linguistic and social diversity of the Asia-Pacific region through trans-disciplinary models of change over time.",Somewhat Likely,"Description: This course introduces the principles and methods of historical linguistics used to reconstruct language histories, which are windows onto the social and cultural lives of past peoples and societies. ",Likely,"Description: This course introduces the principles and methods of historical linguistics used to reconstruct language histories, which are windows onto the social and cultural lives of past peoples and societies.
LO: Construct narratives of the Asia-Pacific past that draw on evidence from a range of disciplines.",Likely,LO: Investigate the linguistic and social past through sources and knowledges from different academic and indigenous perspectives.,,,,,,ASIA2308.pdf
ASIA2311,Gender and Cultural Studies in Asia and the Pacific,https://programsandcourses.anu.edu.au/course/ASIA2311,18-Jun-24,29-Jul-21,,Open to all students,Completed minimum of  24 units,Somewhat Likely (Broad),"Assessment: Group Project: Smartphone Application Prototype
LO: Reflect on the cross-cultural processes and interdisciplinary approaches through which current knowledge about gender and culture in Asia and the Pacific has developed;",Likely,"Description: Through analytical, practice-based and creative assessments, students will gain crucial tools to engage with the politics of everyday life in Asia and the Pacific. 
LO: Reflect on the cross-cultural processes and interdisciplinary approaches through which current knowledge about gender and culture in Asia and the Pacific has developed",Likely,Description: Students will be introduced to key interdisciplinary tools and approaches from the field of gender and cultural studies.,Likely,LO: Identify and evaluate interdisciplinary theories and approaches in gender and cultural studies;,,,,,,ASIA2311.pdf
ASIA2888,Critical Economic Literacy,https://cms.anu.edu.au/cms/design/course/64746/view,15-Jul-24,20-Oct-23,,Open to all students,Normally completed at least 48 units,,,,,,,,,,,,,,
ASIA3039,Research Project in Asian and Pacific Studies,https://cms.anu.edu.au/cms/design/course/63833/view,15-Jul-24,31-Oct-23,,Open to students with particular courses,Normally completed at least 72 units,Likely (Peers),"LO: Provide an effective sounding board for peers' self reflection and research scoping, as well as critical developmental feedback on peers' work.",Somewhat Likely,"LO: Discover and critically review scholarly literature pertaining to a specific region, key debate, or outstanding research problem.",Likely,"LO: Systematically evaluate the available evidence whether numerical, textual, aural, or visual and the strength of analyses and arguments based on this evidence.",,,,,,,,
ASIA3040,Literary Discourse in Japan,https://programsandcourses.anu.edu.au/course/ASIA3040,15-Jul-24,04-Mar-24,,Open to all students,Normally completed at least 72 units,Somewhat Likely (Material),Note: Interaction Unclear,Highly Likely,"LO: Demonstrate an understanding of the relationship between these texts and their literary, cultural, political and historical contexts.",,,Somewhat Likely,Description: ...it is hoped that students will not only gain a deeper understanding of specific texts and writers but will also better understand the range of issues and competing and contradictory narratives that shape modern Japanese culture.,Somewhat Likely,Description: ...better understand the range of issues and competing and contradictory narratives that shape modern Japanese culture.,,,,
ASTR1003,Astronomy and Space,https://programsandcourses.anu.edu.au/course/ASTR1003,18-Jun-24,20-Oct-21,,Open to all students,No prerequisite units,Somewhat Likely (Material),"Description: Spaceflight, space technologies, space law and space medicine.",Somewhat Likely,"LO: Identify and communicate the ways in which space technology can and will affect the modern and future world.
LO: Appreciate and communicate traditional Indigenous understandings of astronomy.",,,,,,,,,Advice: LO could be rewritten for [PLURALISTIC] to be able to hold both Scientific and Aboriginal ways of knowing as true,ASTR1003.pdf
ASTR2013,Foundations of Astrophysics,https://cms.anu.edu.au/cms/design/course/67707/view,20-Jul-24,29-Feb-24,,Open to students with particular courses,Normally completed at least 48 units,Likely (Peers),LO: Work effectively as part of a research group,Not Likely,Unclear from course description,,,,,Somewhat Likely,"Description: The goal of this course is to provide students with the knowledge of the most essential physical processes in astrophysics, and the way in which we can make key inferences about these processes by astronomical observations.",,,,
ASTR3013,Astrophysical Processes,https://cms.anu.edu.au/cms/design/course/48812/view,20-Jul-24,22-Nov-21,,Open to students with particular courses,Normally completed at least 96 units,Likely (Peers),LO: Work effectively as part of a group on problems in these areas,Not Likely,Unclear from course description,,,,,Somewhat Likely,Description: This course provides an introduction to the physical processes that underlie almost all astrophysical phenomena: radiation and fluid dynamics. ,,,,
BIOL2115,Comparitive Physiology,https://programsandcourses.anu.edu.au/course/BIOL2115,18-Jun-24,22-Nov-23,,Open to students with particular courses,Normally completed at least 48 units,Somewhat Likely (Material),"Note: Unclear where the team-tasks are in assessment. Could possibly be framed as collecting and sharing data.
LO: [Interactive] Work as a research team and provide effective peer support and feedback.",Somewhat Likely,"Description:  This knowledge can offer novel engineering insights into the design of our own buildings, transport systems and even cities (biomimetics is a growing and exciting field).",,,,,,,Somewhat Likely,LO: Understand and predict the physiological responses of plants and animals to environmental stresses including temperature extremes and starvation,,BIOL2115.pdf
BIOL3106,Biosecurity,https://programsandcourses.anu.edu.au/course/BIOL3106,18-Jun-24,10-Jan-23,,Open to students with particular courses,Normally completed at least 72 units,Somewhat Likely (Material),LO: Critically analyse the science that underpins our understanding of new biosecurity threats.,Somewhat Likely,"Description: Incursions of these pathogens have severe societal and economic impact once they are introduced into our communities and environments.
LO: Research and evaluate biosecurity information with a specific focus on its value in the Australian context.",Somewhat Likely,"Description: This course starts off with providing an introduction to policies and legislation that frame the collective biosecurity discussions in Australia. It moves on to introduce the biology of plant pathogens that pose biosecurity risks.
LO: Classify the biological attributes that make feral animals, weeds, parasites and pathogenic micro-organisms a biosecurity threat.",,,,,,,,BIOL3106.pdf
BIOL3142,Biomedical Parasitology,https://programsandcourses.anu.edu.au/course/BIOL3142,18-Jun-24,29-Jul-20,Draft 2024,Open to students with particular courses,Normally completed at least 72 units,Somewhat Likely (Material),May be implicit in Practical sessions. ,Somewhat Likely,Description; Every 30 seconds someone is killed by a parasite. Parasites also cause damage to the livestock industry worth several billions of dollars each year. LO: Analyse key features of major parasitic diseases and evaluate their impact on human and animal health.,Somewhat Likely,"Description: In this course we will take a broad and multi-disciplinary approach to the complex and dynamic relationships between parasites and their hosts.
LO: Assess and evaluate different treatment and intervention strategies.",,,,,,,May require slight reframing.,BIOL3142.pdf
BIOL3178,Recovery Biology,https://cms.anu.edu.au/cms/design/course/66465/view,20-Jul-24,18-Jun-24,,Open to students with particular courses,Normally completed at least 96 units,Highly Likely,"LO: Collaborate in group-based presentation of project outcomes to stakeholders, academics and the public.",Likely,"LO: Apply contemporary concepts from across disciplines, including ecological, evolutionary and decision sciences, to management for recovering threatened species and ecosystems.",Likely,"LO: Apply contemporary concepts from across disciplines, including ecological, evolutionary and decision sciences, to management for recovering threatened species and ecosystems",Likely,"LO: Understand the multifaceted nature of conservation and be able to identify relevant stakeholders, and consider diverse, potentially conflicting opinions.",Likely,LO: Apply and evaluate new technologies to enhance management and monitoring of threatened species and ecosystems.,Likely,"LO: Apply contemporary concepts from across disciplines, including ecological, evolutionary and decision sciences, to management for recovering threatened species and ecosystems.
",,
BIOL3188,ANU SynBio Challenge Team Project,https://cms.anu.edu.au/cms/design/course/67796/view,20-Jul-24,08-Mar-24,,Open to students with relevant backgrounds,Normally completed at least 72 units,Highly Likely,"LO: Collaborate in a multidisciplinary team to meet the design challenge
Description: Students will be expected to work cohesively in a team, designing, building and testing a synthetic biology solution to a significant problem. ",Highly Likely,"LO: Discuss and reflect on the ethical and social implications of their project. 
Description: Proponents promise clean energy, sustainable biomanufacturing, food security and effective disease intervention that will transform our society, alter the way we interact with our environment, and allow us to sustainably provide goods and services across all economic sectors",Likely,"LO: Critically analyse published Synthetic Biology literature to identify strategies leading to the design of an innovative solution to a significant environmental, industrial or medical problem.
Description: Students will be expected to learn about Synthetic Biology and its potential applications in the process, with a particular emphasis on developing entrepreneurial skills and knowledge of the commercialisation process.",,,Likely,"LO: Critically analyse published Synthetic Biology literature to identify strategies leading to the design of an innovative solution to a significant environmental, industrial or medical problem.",,,,
BIOL3208,Biology Research Project,https://cms.anu.edu.au/cms/design/course/63739/view,20-Jul-24,20-Jul-24,,Open to students with relevant backgrounds,Normally completed at least 96 units,,,,,,,,,,,,,,
BIOL3210,Appreciating parasites,https://cms.anu.edu.au/cms/design/course/56638/view,20-Jul-24,06-May-24,,Open to students with relevant backgrounds,Normally completed at least 72 units,Likely (Peers),"Description: A willingness to contribute and the ability to work in a team are a requirement for participation.
Assessment: Group oral presentations based on 'the big things we don't know about parasites' 
Assessment: Four blog postings based on interdisciplinary parasite host perspectives (group based)",Somewhat Likely,"LO: 
Apply disciplinary and interdisciplinary frameworks in a systems level appraisal of parasite/host ecology.
Description: through lectures, workshops and practical experiments we will explore the terrestrial and aquatic parasites found in the local environment and contemplate on the challenges parasites face, the bases for their survival and their impact on the environment.",Likely,LO: This is a multi-disciplinary course that ranges from molecular sequencing to evolutionary ecology,,,Likely,LO: Analyse and relate the evolutionary trajectories of specific/local parasite and host populations to their habitats.,Likely,"Description: the dynamic complexity and yet specificity of host-parasite interactions.
LO: Explain the interaction and diversity of parasite and host populations within the Kioloa environment.",,
BUSI3020,International Strategic Management,https://programsandcourses.anu.edu.au/course/BUSI3020,15-Jul-24,31-Oct-22,,Open to all students,Normally completed at least 72 units,Somewhat Likely (Material),LO: Explain and illustrate the international strategic management processes used by top level management in multinational enterprises,Somewhat Likely,"LO: Define, explain and illustrate the relationships among philosophic roots and approaches for international strategic planning and implementation, strategies for value chain activity integration, international business strategies, structure of multinational enterprises, and human resource management orientations, and the role which culture plays in managing multinational enterprises",Somewhat Likely,"LO: Creatively apply knowledge from different approaches to strategic management issues and problems of multinational enterprises, demonstrating thorough understanding of the various international strategic management concepts and their practical application",,,,,,,,
BUSI3024,Export Business Planning,https://programsandcourses.anu.edu.au/course/BUSI3024,15-Jul-24,19-Jun-24,,Open to students with particular courses,Normally completed at least 48 units,Likely (Peers),"Assessment: International Business Plan. At the end of the semester, teams will make professional presentations to their designated clients and their peers via a series of conference-style sessions.",Likely,"Description: Specific topics include the rationale for international marketing; marketing issues related to international economic, financial, political, legal, cultural, technological environments",Somewhat Likely,"LO: Apply core theoretical concepts from international marketing, management and business to find practical solutions to constraints of small businesses",,,Somewhat Likely,"LO: Reflect on the significance of international marketing, business and management in the future direction of global business developments.",,,,
CBEA2001,Indigenous Perspectives in Business,https://cms.anu.edu.au/cms/design/course/70613/view,15-Jul-24,24-Jun-24,New Course,Permission Code,No prerequisite units,Somewhat Likely (Material),"Description: Students will gain an understanding of the rightful place of Australia's Indigenous peoples, an appreciation of key areas and interests in the business world as pertaining to Aboriginal and Torres Strait Island peoples, and an understanding of working alongside communities for business development and relationship building.",Likely,"LO: Evaluate the effectiveness of various modes of communication in intercultural contexts, specifically those related to public policy and business.
Description: These four modules will be linked through three health humanities themes: cultural constructions of health and health care; narrative and visual representations of illness, health and well-being; and performance and health",,,Likely,"LO: Analyse contemporary Australian Indigenous knowledge and perspectives emerging in an ongoing history of interaction and mutual influence with non-Indigenous peoples, ideas and institutions.",Likely,LO: Compare and contrast economic development and neo-colonial policy development and implementation experiences across Australia.,,,,
CHMD2005,Health Humanities,https://cms.anu.edu.au/cms/design/course/69410/view,15-Jul-24,06-Jun-24,New Course,Permission Code,No prerequisite units,Likely (Experts),"LO: Work creatively and collaboratively.
Description: Expert seminars will be presented by writers, dance artists, visual artists, and game developers. ",Somewhat Likely,"LO: Analyse the impact of health law issues in the Australian context for healthcare, health policy and society.",Likely,"Assessment: Students will develop a portfolio of work including an analysis of a pathography or a creative reflection on illness; an analysis of a visual work; and an analysis of a media representation of illness, health condition, or health intervention.",,,,,,,,
COMP1110,Structured Programming,https://programsandcourses.anu.edu.au/course/COMP1110,15-Jul-24,23-Oct-23,,Open to students with particular courses,Normally completed at least 24 units,Somewhat Likely (Common),"Assessment: Group assignment
LO: Deliver and evaluate basic technical documents, presentations, and group interactions, using appropriate tools",Not Likely,Unclear from course description,,,,,,,,,,
COMP1130,Programming as Problem Solving (Advanced),https://programsandcourses.anu.edu.au/course/COMP1130,15-Jul-24,23-Oct-23,,Open to all students,No prerequisite units,Somewhat Likely (Common),"Assessment: Group assignment
LO: Deliver and evaluate basic technical documents, presentations, and group interactions, using appropriate tools",Not Likely,Unclear from course description,,,,,,,,,,
COMP1720,Art and Interaction Computing,https://programsandcourses.anu.edu.au/course/comp1720,18-Jun-24,09-Nov-21,,Open to all students,No prerequisite units,Somewhat Likely (Broad),"Description: The course draws upon the rich practice-led research experiences of the ANU computer science, art and music staff in exploring this field.",Somewhat Likely,Description: The course introduces the range of creative possibilities presented by the computer in the modern art world as well fundamental concepts of visual and interactive design. ,Somewhat Likely,Description: The course introduces the range of creative possibilities presented by the computer in the modern art world as well fundamental concepts of visual and interactive design. ,,,,,,,,COMP1720.pdf
COMP1730,Programming for Scientists,https://programsandcourses.anu.edu.au/course/COMP1730,15-Jul-24,19-Feb-24,,Open to all students,No prerequisite units,Not Likely,Unclear from course description,Not Likely,Unclear from course description,,,,,,,,,"Unclear how TD skills are developed (for example, [PLURALISTIC] are there many paradigms/ways of engaging with/using code or [CONTEXT] what is the nature/bigger picture of practical problems that can be solved with programming.",COMP1730.pdf
COMP2100,Software Construction,https://programsandcourses.anu.edu.au/course/COMP2100,15-Jul-24,01-Dec-23,,Open to students with particular courses,Normally completed at least 48 units,Somewhat Likely (Common),"Assessment: Group Project
Note: interactive not covered in LO",Not Likely,Unclear from course description,,,,,,,,,,
COMP2120,Software Engineering,https://programsandcourses.anu.edu.au/course/comp2120,18-Jun-24,31-Mar-22,,Open to students with particular courses,Normally completed at least 48 units,Somewhat Likely (Common),"Description: Real-world software development is a complex and dynamic activity involving people, technology and processes interacting within a complex environment of clients, users and other stakeholders while being observant of technological, physical, social, legal, and ethical constraints.
LO: Work co-operatively in a team to solve a software engineering problem.",Somewhat Likely,"Description: We will use real-world examples such as distributed, high-integrity, web-based systems where rigorous software engineering can demonstrably enhance business value.
LO: Apply modern requirements gathering and software design techniques in the context of a realistic software engineering process.",Likely,"Description: This course will empower students with the ability and confidence necessary to exercise critical thinking and professional judgment to select and apply appropriate knowledge, practices and tools to the development of non-trivial software systems.
Description: Students will learn how practices and tools can be adapted to suit specific project needs and contexts. Knowledge, practices and tools considered in this course will include process models, requirements engineering, design, modelling and user experience.",,,,,,,,COMP2120.pdf
