Course_Code,Course_Name,URL,Last_Assessed,Last_Published,Note,Prerequisite_Courses,Prerequisite_Units,TD_Interactive,TD_Interactive_Written,TD_Context,TD_Context_Written,TD_Integrative,TD_Integrative_Written,TD_Pluralistic,TD_Pluralistic_Written,TD_Change,TD_Change_Written,TD_Systemic,TD_Systemic_Written,Advice,Assessment URL
ECON3127,Computational Methods in Economics,https://programsandcourses.anu.edu.au/course/ECON3127,18-Jun-24,26-Oct-18,,Open to students with particular courses,Normally completed at least 72 units,Somewhat Likely (Material),"Description: Students will also learn how to obtain, manipulate and represent data, using tools such as scatterplots and histograms.
LO: Algorithm and data manipulation and visualization of economic data",Not Likely,Needs to demonstrate consideration of the broader context.,Somewhat Likely,Perhaps: LO: Reinforcement of key ideas from economic analysis,,,,,,,,https://anu365.sharepoint.com/:f:/r/sites/AcademicPortfolioInitiatives/Shared%20Documents/Curriculum%20Reform/Curriculum%20Updates/TD%20Course%20List%20Assessments?csf=1&web=1&e=eApdfk
ECON3128,Resource and Environmental Economics,https://programsandcourses.anu.edu.au/course/ECON3128,18-Jun-24,26-Oct-18,,Open to students with particular courses,Normally completed at least 72 units,Somewhat Likely (Material),"LO: use economic modelling to evaluate various approaches to the design of efficient environmental policies and of rules for the optimal management of natural resources;
",Somewhat Likely,"Description:  It identifies conditions under which market failures lead to environmental degradation or to the overexploitation of natural resources, and discusses economic policies that can counteract such market failures.
LO: demonstrate an understanding of how various market failures may lead to environmental degradation or the overexploitation of natural resources;",Somewhat Likely,"This course analyses the economic principles underlying the design of efficient environmental policies and the optimal management of natural resources.
LO: Use economic modelling to evaluate various approaches to the design of efficient environmental policies and of rules for the optimal management of natural resources;",,,,,Somewhat Likely,LO: Construct and analyse simple dynamic models of natural resource management.,,https://anu365.sharepoint.com/:f:/r/sites/AcademicPortfolioInitiatives/Shared%20Documents/Curriculum%20Reform/Curriculum%20Updates/TD%20Course%20List%20Assessments?csf=1&web=1&e=eApdfk
ECON3180,Advanced Behavioral Economics,https://programsandcourses.anu.edu.au/course/ECON3180,18-Jun-24,28-Sep-21,,Open to students with particular courses,Normally completed at least 96 units,Somewhat Likely (Material),LO: demonstrate an understanding of what the Behavioral Economics program is and how it differs from classical economic analysis;,Somewhat Likely,"Could benefit from some real-world examples in the description to provide context. 
LO: demonstrate an understanding of the main theoretical and empirical debates in Behavioral Economics and evaluate the contribution of Behavioral Economics to broader economic knowledge, as well as other areas.
",Somewhat Likely,"Description: Behavioral economics refers to the research program that attempts to incorporate more realistic psychological foundations into models of economic behavior. 
LO: Describe and interpret the latest findings from Behavioral Economics research, demonstrating an understanding of how they translate into individual behaviour and apply them to public policy questions;",,,,,,,,https://anu365.sharepoint.com/:f:/r/sites/AcademicPortfolioInitiatives/Shared%20Documents/Curriculum%20Reform/Curriculum%20Updates/TD%20Course%20List%20Assessments?csf=1&web=1&e=eApdfk
EMSC3022,Planetary Science,https://cms.anu.edu.au/cms/design/course/64427/view,20-Jul-24,09-Jul-24,,Open to students with relevant backgrounds,Normally completed at least 72 units,Somewhat Likely (Broad),"Assessment: Peer review
LO: Collaborate with peers to critically evaluate and present on planetary science topics. ",Somewhat Likely,"Description: How did the Earth form? How do planets form? How can we search for life beyond Earth? 
We will study the essential ingredients for life on planets and strategies to search for life beyond Earth.",Somewhat LIkely,"LO: Apply data and approaches used on Earth  (e.g., experimental data and field analog sites) to other planetary bodies.",,,Likely,"LO: Explain, in scientific terms, the astronomical context of planet formation in our solar system and exoplanetary systems, and the evolution of planetary bodies.
Description:  We will step back in time to examine the earliest solar system, going back to the origin of the elements themselves and the processes that build new solar systems, planetary surfaces and planetary interiors. ",Somewhat likely,"LO: Demonstrate laboratory skills through a range of modules requiring, for example, models of orbital dynamics, descriptions of rocks from the solar system, and experiments/calculations related to the fundamental properties of planetary bodies. ",,
EMSC3023,Marine Biogeochemistry,https://cms.anu.edu.au/cms/design/course/42921/view,20-Jul-24,03-Nov-20,,Open to students with particular courses,Normally completed at least 72 units,Somewhat Likely (Broad),"Activities: Practicals, Field Trip",Somewhat Likely,"Description: with a focus on developing an understanding of the interplay and responses between ocean chemistry, marine biology and global change",Likely,"LO: This is an advanced course that explores the relationships between marine chemistry, marine biological and geochemical processes - with a focus on developing an understanding of the interplay and responses between ocean chemistry, marine biology and global change.",,,,,Somewhat likely,"Description: Topics covered include the theory and application of chemical and isotopic tracers in oceanography and palaeoceanography, macro- and micro-nutrient cycling, sediment and suspended particulate interactions",,
ENGN2300,Engineering Design 2: Systems Approaches for Design,https://cms.anu.edu.au/cms/design/course/68164/view,17-Jul-24,17-May-24,,Open to students with particular courses,Normally completed at least 48 units,Likely (Experts),"Description: Design Project - You will be challenged in small teams to generate an engineering design using the systems approach that meets the requirements of project stakeholders..
Operate as an effective member of an engineering team combining different disciplinary perspectives and strengths
LO: Effectively communicate engineering designs through engineering models
LO: Operate as an effective member of an engineering team across multiple disciplines",Likely,"LO: Research succinct and relevant system-level requirements for an engineering design within a transdisciplinary context including social, economic, and environmental perspectives",,,,,Likely,Assessment: Design Project,Likely,LO: Reflect on taking a systems approach to engineering design in the context of professional engineering,,https://anu365.sharepoint.com/:f:/r/sites/AcademicPortfolioInitiatives/Shared%20Documents/Curriculum%20Reform/Curriculum%20Updates/TD%20Course%20List%20Assessments?csf=1&web=1&e=eApdfk
ENGN2301,Engineering Design 3: Systems Approaches for Analysis,https://programsandcourses.anu.edu.au/course/engn2301,18-Jun-24,17-May-24,,Open to students with particular courses,Normally completed at least 48 units,Likely (Experts),"LO: Operate as an effective member of an engineering team for an external stakeholder
Description: You will be challenged in small teams to design the testing processes enabling you to evaluate an engineering design. ",Likely,"LO: Evaluate an engineering system through the design of engineering tests, incorporating business, social and environmental arguments",Likely,"Description: You will apply techniques to analyse a system from a range of perspectives, from understanding human factors through to optimisation.",,,Likely,"LO: Make predictions about the performance of a system based on engineering models, understanding that engineering design will depend on the context for which it is being developed",Likely,LO: Reflect on taking a systems approach to engineering testing in the context of professional engineering,,https://anu365.sharepoint.com/:f:/r/sites/AcademicPortfolioInitiatives/Shared%20Documents/Curriculum%20Reform/Curriculum%20Updates/TD%20Course%20List%20Assessments?csf=1&web=1&e=eApdfk
ENGN3013,Engineering for a Humanitarian Context,https://programsandcourses.anu.edu.au/course/ENGN3013,15-Jul-24,13-Aug-23,,Open to students with relevant backgrounds,Normally completed at least 96 units,Likely (Experts),"Description: This includes taking part in the 7-14 day immersive experiences, 1 1/2 days of workshops before the immersion, a day workshop after the immersion and time for assessment preparation and presentation",Likely,"LO: Apply appropriate technology and system design principles to humanitarian contexts incorporating social, economic and environmental factors",Likely,Identify and evaluate appropriate models of development and engineering and design processes for a range of humanitarian contexts to promote social justice and address the root cause of disadvantage,Likely,LO: Apply existing discipline knowledge to cross-disciplinary humanitarian contexts and describe how humanitarian principles and skills can inform and enhance discipline practice,Likely,"LO: Discuss significant aspects of Australia s international and domestic aid and development sector, including its history, geopolitical context and contemporary approaches",,,,
ENVS1001,Environment and Society: Geography of Sustainability,https://programsandcourses.anu.edu.au/course/ENVS1001,18-Jun-24,24-May-24,,Open to all students,No prerequisite units,Likely (Experts),"Description: Guest speakers will be drawn from the many ANU Colleges and the government, community and business sectors.
Assessment: Fieldtrip report",Likely,"Description: The contrasts and connections between scientific and social science theory and methods will be examined. [...] Other key concepts critically explored will include social justice, equity and sustainability.
LO:  Demonstrate understanding of awareness of theories explaining and informing environmental governance and the formulation of policy instruments.",Likely,"Description: These issues will be explored through case studies that will include: the role of Indigenous people in resource management, the international dimension of global climatic change, water and land degradation and biodiversity conservation.
LO: Demonstrate understanding of different perspectives proposing to explain causes and consequences of environmental change.",,,,,,,,https://anu365.sharepoint.com/:f:/r/sites/AcademicPortfolioInitiatives/Shared%20Documents/Curriculum%20Reform/Curriculum%20Updates/TD%20Course%20List%20Assessments?csf=1&web=1&e=eApdfk
ENVS1004,Australia's Environment,https://programsandcourses.anu.edu.au/course/ENVS1004,15-Jul-24,19-Jun-24,,Open to all students,No prerequisite units,Likely (Peers),"Assessment: Research Synthesis (Group)
Description: Lectures are delivered by a diverse range of disciplinary experts.",Likely,LO: Discuss the characteristics of water in Australia and the interacting environmental and social factors;,Likely,LO: Integrate knowledge across a range of biophysical disciplines to complex environmental problems;,,,Likely,LO: Describe the development of Australian soils and the implications for ecosystem productivity;,,Likely,LO: Recognise the patterns and processes which characterise Australia s climate and explain their connection to the evolution of Australian landscapes and biota;,
ENVS1008,Sustainable Development,https://cms.anu.edu.au/cms/design/course/67699/view,15-Jul-24,06-Jun-24,,Open to all students,No prerequisite units,Highly Likely,"Assessment: Group work projects
Class Schedule: Case studies led by different experts",Likely,"Description: SThe future needs you to contribute to sustainable solutions to big issues including climate change, food security, health, land management, biodiversity loss, resource competition, and societal equity. ",Likely,,,,Highly Likely,"LO: Demonstrate application of knowledge and skills propose solutions to environmental problems.
Description: Students are introduced to a range of viewpoints, theories and frameworks useful for thinking about and understanding social and environmental change in the context of sustainable development.",Highly Likely,"LO: Recognise, understand and explain the complexity of linkages between drivers, pressures, impacts and responses for contemporary sustainable development challenges","May be higher levels in Collaboration/Context, noting as a first-year course.",https://anu365.sharepoint.com/:f:/r/sites/AcademicPortfolioInitiatives/Shared%20Documents/Curriculum%20Reform/Curriculum%20Updates/TD%20Course%20List%20Assessments?csf=1&web=1&e=eApdfk
ENVS2005,Island Sustainable Development,https://cms.anu.edu.au/cms/design/course/67658/view,15-Jul-24,19-Jun-24,Draft in CMS,Open to all students,Normally completed at least 24 units,Highly Likely,LO: Interact with people from another country in a culturally sensitive manner ,Highly Likely,"LO: Understand the complex social, environmental and cultural challenges that confront an island nation, like Fiji
Description: The course will investigate the interactions between economic development and the sustainable management of key sectors including fisheries, agriculture, water catchment management, tourism, waste management, cultural heritage management and marine and coastal biodiversity.",Likely,LO: Undertake analysis of issues related to island sustainable development and to present these in a coherent manner ,Likely,"LO: Effectively present and discuss ideas, and to listen, assess and respond to ideas of others",Likely,LO: Apply interdisciplinary approaches to resolving sustainable development issues in an island context,Likely,"Description: These meetings recognised that Small Island Developing States (SIDS) have a narrow range of resources, which forces undue specialization; excessive dependence on international trade and hence vulnerability to global developments; relatively small watersheds and threatened supplies of fresh water; costly public administration and infrastructure, including transportation and communication; and limited institutional capacities and domestic markets, which are too small to provide significant scale economies.  ",,
ENVS2017,Vietnam Field School,https://cms.anu.edu.au/cms/design/course/67694/view,15-Jul-24,19-Jun-24,,Permission Code,Normally completed at least 24 units,Highly Likely,"LO: Conduct rapid research in a team environment
Description: The in-country work will include fieldtrips, homestays, language training, as well as formal classes given by staff from ANU and from An Giang University (Mekong Delta).",Likely,"LO: Reflect deeply on the impact of rapid change on culture, environment and local economies",,,,,Somewhat Likely,"LO: Reflect deeply on the impact of rapid change on culture, environment and local economies",Likely,Description: The course focuses on experiencing and understanding the complex relationships between development and the environment as seen through every day living.,,
ENVS2018,Environmental Field School,https://cms.anu.edu.au/cms/design/course/67693/view,15-Jul-24,22-Apr-24,,Open to students with particular courses,Normally completed at least 24 units,Highly Likely,"Assessment: Group work: Professional practice in Environmental Sciences will require group work. Task requires group organisation and delivery of a presentation
Description: The field work is complemented by field trip workshops.",Likely,LO:  Collect a diversity of data that describe the biophysical attributes and processes of ecosystems.,Likely,"LO: Demonstrate a capacity to choose appropriate data collection methods, design appropriate sampling strategies and communicate findings about ecosystem patterns, processes and resource management impacts.",,,Likely,"Desrlipnios: You will learn to appreciate how soils, landforms, vegetation and fauna should be considered in research and decision-making. ",,,,
ENVS2023,Sustainable Agricultural Systems,https://cms.anu.edu.au/cms/design/course/62724/view,15-Jul-24,19-Jun-24,,Open to all students,Normally completed at least 48 units,Likely (Experts),"Description: 
Research project (assessments 5 & 6) involve weekly small group discussions with specialist industry stakeholders. This supplements the industry lead knowledge being presented in guest lectures.",Likely,"Description: Production systems are placed within the broader social, cultural and economic contexts in which they operate",Somewhat Likely,LO:  Demonstrate the knowledge of complex agricultural systems using a range of frameworks and tools.,Likely,"LO:  Understand key agricultural systems concepts and perspectives at regional, national and global scales.",Somewhat Likely,LO: Describe constraints and opportunities for future sustainable agricultural systems.,,,,
ENVS2024,Agricultural Systems,https://programsandcourses.anu.edu.au/course/ENVS2024,15-Jul-24,19-Jun-24,,Open to all students,Normally completed at least 72 units,Highly Likely,"Assessment: Stakeholder Communications Exercise (Group)
Description: This winter intensive course will involve farm visits to the greater ACT or Central West region. Overnight stays will be required and additional fees will apply. Please refer to the Class Summary for full details.",Likely,LO: Critically review literature and 'real life' examples of agricultural production in context as a system.,,,,,Likely,"Description: A range of land management issues are examined, with students developing the skills to design and implement improved farming systems to address these issues in the context of barriers to adoption, and key enablers of practice change",Highly Likely,"LO: Integrate knowledge of production systems to view Australian agrifood as a system.
Description: This course is intended to provide breadth of systems knowledge to allow students of a range of knowledge domains to come together and apply their knowledge in an agricultural context.",,
ENVS3004,Land and Catchment Management,https://programsandcourses.anu.edu.au/course/ENVS3004,15-Jul-24,22-Apr-24,,Open to all students,Normally completed at least 72 units,Likely (Experts),"Assessment: Field data reporting
Description: All students engage with WIL partners (internal/external) as a minor component of the course",Likely,"LO: Reflect on how land management strategies have been informed by (and continues to be shaped by) institutional perspectives, historical development, policy and social drivers
Description: The course emphasises the interdisciplinarity of land resource management and examines content by investigating the physical, economic, social and institutional components of a problem.",,,,,Highly Likely,"LO: Describe the natural and anthropogenic drivers of land degradation, past, present and future, at continental, regional and local scales",,,,
ENVS3013,Climate Change,https://programsandcourses.anu.edu.au/course/ENVS3013,15-Jul-24,19-Jun-24,,Open to students with particular courses,Normally completed at least 72 units,Likely (Experts),"LO: Develop a broad scientific basis for evaluating the likely causes and potential impacts of climate variability and change, and communicate this in a range of formats suitable for diverse audiences.
Activities: Team Teaching",Likely,"LO: Synthesise understanding of processes that influence climate variability and change, and their application to research and policy contexts.
Description: The scientific basis for climate change is also applied to understanding observed impacts and its relevance for global policy contexts",,,,,Highly Likely,"LO: Analyse climate data to interpret past, present and future climate variability and change.",,,,
ENVS3020,"Climate Change: Science, Society, and Policy",https://programsandcourses.anu.edu.au/course/ENVS3020,18-Jun-24,16-Jul-05,Draft for 2025,Open to all students,Completed minimum of  72 units,Likely (Experts),"Description: Contributors to the course include experts from across the ANU and representatives of various government departments, industry, business, and community groups, and research organisations.
Assessment: UN Negotiation or Policy analysis",Likely,"Current and likely future impacts of global warming on ecosystems and human activities are considered, including biodiversity, human health, regional inequality, and vulnerability. ",,"Description: The culmination of the course is a mock treaty negotiation for ""The Canberra Agreement"" under the United Nations Framework Convention on Climate Change.",,"LO: Engage effectively with denialism, skepticism, and other forms of disagreement",,LO: Debate future climate change policy in the context of international climate change negotiations.,,,,https://anu365.sharepoint.com/:f:/r/sites/AcademicPortfolioInitiatives/Shared%20Documents/Curriculum%20Reform/Curriculum%20Updates/TD%20Course%20List%20Assessments?csf=1&web=1&e=eApdfk
ENVS3040,Complex Environmental Problems in Action,https://programsandcourses.anu.edu.au/course/ENVS3040,18-Jun-24,10-Apr-24,Draft for 2025,Open to all students,Completed minimum of  72 units,Likely (Experts),"Description: The first two cases present complex local and national issues in collaboration with key stakeholders. Students engage with these issues by drawing on a range of theoretical concepts and practical tools.
LO: Understand and apply the case study approach to participate effectively in integrative, team-based research projects.
Assessment: Learning portfolio including a group work product and individual reflection",Highly Likely,"Description: This course uses three case studies to develop a multi-faceted, research-based understanding of complex environmental problems that graduating students can apply in future research or work environments.
LO: Apply problem solving skills in environmental studies and environmental science, including problem framing, synthesis and critical reflection.",Highly Likely,"LO: Apply problem solving skills in environmental studies and environmental science, including problem framing, synthesis and critical reflection.",,,,,,,Note that prerequisites may change to ensure BENSU/AENSU students have priority.,https://anu365.sharepoint.com/:f:/r/sites/AcademicPortfolioInitiatives/Shared%20Documents/Curriculum%20Reform/Curriculum%20Updates/TD%20Course%20List%20Assessments?csf=1&web=1&e=eApdfk
ENVS3344,Environmental Justice Practicum,https://programsandcourses.anu.edu.au/course/ENVS3344,15-Jul-24,19-Jun-24,,Open to all students,Normally completed at least 72 units,Highly Likely,"Assessment: Research project (group)
Description: This is an interdisciplinary course involving students from the College of Law and the Fenner School of the Environment and Society. [...]  Students will attend seminars on topics of interest, and work in cross-disciplinary teams on environmental issues.",Likely,"LO:  Research and critically analyse environmental issues, incorporating legal, scientific and First Nations' perspectives.",Likely,LO: Develop and apply practical legal and environmental science skills and approaches in environment and planning law.,,,Likely,"LO: Assess current measures to promote access to environmental justice and consider improvements to measures to achieve environmental justice.
LO: Evaluate the role and ability of environmental law and science to propose solutions to deliver improved environmental outcomes.",,,,
FREN3109,Global Paris,https://cms.anu.edu.au/cms/design/course/70948/view,15-Jul-24,03-Jul-24,,Open to students with particular courses,Normally completed at least 72 units,Highly Likely,"Description: Taking the city as analytical object, the course will be composed of seminars, visits to cultural sites including museums, monuments and ch teaux, collaborative workshops and guided walking tours of historically and culturally-significant districts.
Assessment: Group Museum Workshop ",Highly Likely,"LO: navigate on-site language immersion, conducting intellectual and everyday cultural interactions with native French speakers in French.
Description: The analyses undertaken in this course will equip students with the knowledge and language to understand core concepts surrounding French history, culture and identity, studied through the prism of Parisian cultural heritage.",,,,,Likely,"LO: develop an understanding of the concepts of Republicanism, multiculturalism and Frenchness through exploration of key sites, discourses, artifacts and encounters in Paris;",,,,
HIST2112,"Plagues, Pandemics and Public Health in History",https://programsandcourses.anu.edu.au/course/hist2112,18-Jun-24,23-May-24,Disestablished,Open to all students,Normally completed at least 48 units,,There are hints of interaction through tutorial participation and the primary source activity. This could be framed as TD collaboration if appropriate. ,Somewhat Likely,"Description: this course provides cultural, economic, environmental, legal, political and social perspectives on various forms of sickness
LO: demonstrate a capacity to analyse sickness and health through the lenses of cultural, economic, environmental, legal, political and social history; ",Somewhat Likely,Assessment: Primary source essay:  Question: How does this source help to illuminate the issues of power and authority in the history of sickness and health for this particular place and period? ,,,,,,,,https://anu365.sharepoint.com/:f:/r/sites/AcademicPortfolioInitiatives/Shared%20Documents/Curriculum%20Reform/Curriculum%20Updates/TD%20Course%20List%20Assessments?csf=1&web=1&e=eApdfk
