Course_Code,Course_Name,URL,Last_Assessed,Last_Published,Note,Prerequisite_Courses,Prerequisite_Units,TD_Interactive,TD_Interactive_Written,TD_Context,TD_Context_Written,TD_Integrative,TD_Integrative_Written,TD_Pluralistic,TD_Pluralistic_Written,TD_Change,TD_Change_Written,TD_Systemic,TD_Systemic_Written,Advice,Assessment URL
COMP2400,Relational Databases,https://programsandcourses.anu.edu.au/course/comp2400,15-Jul-24,16-Feb-24,,Open to students with relevant backgrounds,Normally completed at least 48 units,Not Likely,Unclear from course description,Not Likely,Unclear from course description,,,,,,,,,,
COMP3425,Data Mining,https://programsandcourses.anu.edu.au/course/comp3425,15-Jul-24,27-Oct-22,,Open to students with particular courses,Normally completed at least 72 units,Not Likely,Unclear from course description,Somewhat Likely,"LO: Reflect upon ethical and social impacts of data mining.
Description: Massive amounts of data are being collected by public and private organisations, and research projects, while the Internet provides a very large source of information about almost every aspect of human life and society. Analysing such data can provide significant benefits to an organisation. ",,,,,,,,,,
COMP3500,Software Engineering Project,https://programsandcourses.anu.edu.au/course/COMP3500,18-Jun-24,23-Oct-23,Draft updated for TD-GA,Open to students with particular courses,Normally completed at least 96 units,Somewhat Likely (Common),"Description: Most students will work on projects for an industry, government or university client.
LO: Work as an effective member of a team to implement a software based solution that delivers measurable value to an industry or university client.
LO: How personality traits can impact upon team performance and how to use individual traits to achieve the most from team work.
LO: Communicate effectively, orally and in writing, with peers, supervisors and commercial clients/stakeholders.",Somewhat Likely,"Description: Students will also study relevant aspects of the software engineering milieux.
LO: Creatively identify and implement a solution to a complex problem that exists within the domain of ICT.",Somewhat Likely,"Description: Students work in small groups and participate in all the development phases (requirements analysis, design, construction, testing and documentation) of a nontrivial software system. As well, each group has to address the control of the development process by constructing and following a detailed software development management plan. Students will also study relevant aspects of the software engineering milieux.",,,,,Likely,"LO: Work as an effective member of a team that creatively identifies, implements, and delivers a software solution to a complex problem.",,COMP3500.pdf
COMP3900,Human-Computer Interaction,https://programsandcourses.anu.edu.au/course/comp3900,18-Jun-24,17-May-24,,Open to students with relevant backgrounds,Normally completed at least 48 units,Somewhat Likely (Common),Assessment: Prototype design - Students will work in groups to undertake ideation and create a prototype of a design idea that relates to the given design brief. ,Somewhat Likely,"LO: Demonstrate an awareness of ethical considerations in technology design, and apply ethical approaches to design research and practice.",Likely,"Description: This course [...] will introduce students to key interaction and experience design paradigms, approaches and methods.
LO: Apply social, cognitive, emotional, and accessibility theories and lenses in critiquing existing technologies, and developing new design ideas.",,,,,,,,COMP3900.pdf
COMP4500,Software Engineering Team Project,https://programsandcourses.anu.edu.au/course/COMP4500,18-Jun-24,10-May-24,Draft updated for TD-GA,Open to students with particular courses,Normally completed at least 96 units,Somewhat Likely (Common),"Description: Most students will work on projects for an industry, government or university client.
LO: Work as an effective member of a team to implement a software based solution that delivers measurable value to an industry or university client.
LO: How personality traits can impact upon team performance and how to use individual traits to achieve the most from team work.
LO: Communicate effectively, orally and in writing, with peers, supervisors and commercial clients/stakeholders.",Somewhat Likely,"Description: Students will also study relevant aspects of the software engineering milieux.
LO: Creatively identify and implement a solution to a complex problem that exists within the domain of ICT.",Likely,"Description: Students will lead small teams to plan (define, estimate, schedule) and manage an appropriate set of activities to ultimately deliver a software product. ",,,Highly Likely,"LO: Develop as a leading member of a team that creatively identifies, implements, and delivers a software solution to a complex problem.",,,,COMP3500.pdf
COMP4880,Computational Methods for Network Science,https://programsandcourses.anu.edu.au/course/comp4880,18-Jun-24,20-Sep-21,,Open to students with particular courses,Normally completed at least 96 units,Somewhat Likely (Material),LO: Demonstrate a thorough understanding of the fundamental principles of using computational approaches to formulate and answer social science questions.,Somewhat Likely,"Description: The course equips the students with in-depth knowledge and hands-on experience in working with network data to study social processes at both the individual and aggregate levels.
LO: Demonstrate a working understanding in the ethical concerns of data drive analysis and experiments in human behavior.",Likely,"Description [COMP4880] covers the essentials of using computational approaches to pose and answer social science research problems.
LO: Demonstrate a thorough understanding of the fundamental principles of using computational approaches to formulate and answer social science questions.",,,,,,,,COMP4880.pdf
CRIM2009,Corruption in our world,https://cms.anu.edu.au/cms/design/course/57717/view,15-Jul-24,22-Jun-24,Updated for TD-GA,Open to all students,Normally completed at least 24 units,Somewhat Likely (Broad),Description: Teaching is intensive in the Summer period and provides students an opportunity to collaborate across disciplines in studying a phenomena that touches all aspects of human activity.,Somewhat Likely,"Description: this course examines the phenomenon of corruption, identifies the contexts within which it flourishes, explores means of measuring it, ",Somewhat Likely,"LO: Describe different concepts, definitions and measures of corruption;",,,,,,,LOs might need revision to meet TD GA,CRIM2009.pdf
CRIM3002,Corruption in Sport,https://programsandcourses.anu.edu.au/course/CRIM3002,18-Jun-24,01-Jul-24,Updated for TD-GA,Open to all students,Completed minimum of 72 units,Likely (Peers),Assessment: Group presentation (10%) and Tutorial participation,Likely,Description: This course will introduce students to the multifaceted nature of corruption in sport and to useful theoretical approaches to analysing the phenomena.,,,Likely,"Description: On completion, students will have the academic skills to critically analyse the phenomena by synthesising a variety of disciplinary approaches to this issue and show them that sport is now so much more than just a game.
LO [Plurality]: evaluate and compare the utility of different disciplinary approaches to the study of corruption",Likely,LO: Develop practical and policy oriented recommendations to counter corruption in different sporting contexts,,,,CRIM3002.pdf
DEMO2002,Population Analysis,https://programsandcourses.anu.edu.au/course/DEMO2002,15-Jul-24,19-Jun-24,,Open to all students,Normally completed at least 24 units,Somewhat Likely (Common),Assessment: Group exercises,Somewhat Likely,Description: This course provides the basic analytical foundation for understanding societal change.,Somewhat Likely,LO: access various demographic data sources and understand their relative strengths and weaknesses.,,,,,,,,
DESN2008,Design Thinking,https://programsandcourses.anu.edu.au/course/DESN2008,15-Jul-24,25-Jun-24,,Open to all students,Normally completed at least 36 units,Likely (Peers),Assessment: Design Challenge ,Likely,"Description: Design Thinking describes processes involving the application of user research, ideation, participation, and collaboration for problem-solving and innovation in a wide range of cultural contexts. ",Likely,"LO: demonstrate and apply critical thinking through design methodologies, theories, and processes",,,,,,,,
DESN3011,Design Studio: Engagement and Collaboration,https://programsandcourses.anu.edu.au/course/DESN3011,18-Jun-24,01-Jul-24,Updated for TD-GA,Open to students with relevant backgrounds,Completed minimum of 96 units,Likely (Experts),"Description: It requires students to extend their design knowledge and skills through projects requiring demonstration and application of critical thinking, collaboration, adaptability, ethical practice, and professional conduct. 
LO: Engage collaboratively with clients, industry, the public, and peers as an informed and ethical practitioner",Likely,"LO: articulate design problems and develop innovative design solutions through creative practice;
Description: Students collaborate in transdisciplinary teams across authentic projects, encompassing not-for-profit, government, industry, and university sectors.",Likely,"Description: Teams conduct research, frame and address transdisciplinary problems, and creatively resolve them in collaboration with peers and stakeholders. ",,,Highly Likely,"Description: This course provides a platform for transdisciplinary problem solving and engagement with clients, industry, and the general public.
LO: Employ design knowledge in transdisciplinary problem solving across authentic industry projects",,,,DESN3011.pdf
ECHI1006,The Australian Economy: Past and Present,https://cms.anu.edu.au/cms/design/course/37353/view,17-Jul-24,30-Oct-19,,Open to all students,No prerequisite units,Somewhat Likely (Material),Not clear. Likely more needed for TD-GA.,Somewhat Likely,"Description:  It is intended for students who are seeking a broad understanding of how the economy works. 
LO: present a variety of interpretations and debates on Australia   s economic history",Somewhat Likely,"Description: The approach adopted will emphasise that the present Australian economy needs to be seen in the context of the historical pattern of development and change. While the course deals primarily with economic factors, social and political contexts and connections will also be considered.
LO: demonstrate an understanding of the ways in which the Australian economy has changed over time and will have developed a perspective of Australia's present position in the international economy that takes these historical changes into account",,,Likely,LO: demonstrate an understanding of the ways in which the Australian economy has changed over time and will have developed a perspective of Australia s present position in the international economy that takes these historical changes into account,,,,ECHI1006.pdf
ECHI3009,World Economy Since 1800,https://programsandcourses.anu.edu.au/course/ECHI3009,18-Jun-24,08-Jul-21,,Open to students with particular courses,Normally completed at least 72 units,Somewhat Likely (Material),"Assessment: Group project (40%)
LO: work in teams to analyse and present key findings of academic research and their strengths, limitations and context in the wider fields of relevant inquiry",Somewhat Likely,Description: Emphasis is on institutional changes in how societies organize economic and political activities and variation in development among geographic regions.,Likely,"Description: This course analyzes historical major economic, political, and social changes in the world economy. 
LO: these include factors contributing to increases in economic performance, changes in the form of government, technological change (including industrialization), and episodes of integration and disintegration of the global economy.",,,,,,,,ECHI3009.pdf
ECON1100,Economics I,https://programsandcourses.anu.edu.au/course/ECON1100,15-Jul-24,16-Sep-19,,Open to students with particular courses,No prerequisite units,Likely (Experts),Class Activity: Guest Speaker series,Likely,"LO: demonstrate the ability to critically evaluate many newspaper and magazine articles covering current economic events;
LO: demonstrate an understanding of the economic tools taught in class and be able to apply them to analyse real world problems and policy issues.",,,,,Somewhat Likely,"Description: The analysis will be applied to a number of topical public policy issues including carbon pricing, intellectual property, infrastructure pricing and provision, and road charging. The course finishes with an examination of public choice: the economics of the political process.",,,,
ECON2009,Labour Economics and Industrial Relations,https://programsandcourses.anu.edu.au/course/ECON2009,17-Jul-24,19-Sep-23,,Open to students with particular courses,Normally completed at least 48 units,Somewhat Likely (Material),LO:  interpret labour market statistics and empirical evidence in academic papers and policy reports;,Somewhat Likely,"Description: The topics to be covered are: labour supply, including determinants of labour market participation and hours of works; labour demand; labour market equilibrium and wage determination; compensating wage differentials; investments in human capital and returns to education; earnings distribution; labour mobility; labour market discrimination; role of unions; incentive pay; and unemployment. ",Somewhat Likely,"Description: This course provides a broad introduction to the economic analysis of labour market issues. [...] Policy applications will be emphasized.
*Needs a description about context as well as topics",,,,,,,,https://anu365.sharepoint.com/:f:/r/sites/AcademicPortfolioInitiatives/Shared%20Documents/Curriculum%20Reform/Curriculum%20Updates/TD%20Course%20List%20Assessments?csf=1&web=1&e=eApdfk
ECON2013,Behavioural Economics,https://programsandcourses.anu.edu.au/course/ECON2013,18-Jun-24,28-Sep-21,,Open to all students,Completed minimum of 24 units,Somewhat Likely (Material),LO: demonstrate an understanding of the tools taught in class and be able to recognise their application to the analysis of real world situations;,Somewhat Likely,demonstrate an understanding of the tools taught in class and be able to recognise their application to the analysis of real world situations;,Somewhat Likely,"Description: This course aims to teach students some techniques of behavioural economics, classical economics, and compare the two approaches.
LO: demonstrate an understanding of the tools taught in class and be able to recognise their application to the analysis of real world situations;
",,,,,,,,https://anu365.sharepoint.com/:f:/r/sites/AcademicPortfolioInitiatives/Shared%20Documents/Curriculum%20Reform/Curriculum%20Updates/TD%20Course%20List%20Assessments?csf=1&web=1&e=eApdfk
ECON2014,Managerial Economics,https://programsandcourses.anu.edu.au/course/ECON2014,18-Jun-24,31-Oct-22,,Open to students with particular courses,Normally completed at least 48 units,Somewhat Likely (Material),"Class summary: ECON2014 is a highly engaging course, so active regular participation in class discussions is highly expected in the course and course develops skills critically needed for a successful future Global business/economics Leaders.
Class Summary: ECON2014 Managerial Economics course is using Cross-Cultural responsive teaching philosophy in its delivery, that means that this course highly encourages the use of your cultural background and the use of your previous cultural knowledge and expertise in your assignments, but also sharing in class with the students in a course.",Somewhat Likely,"Description: course concludes with key contemporary applications of Organisational Architecture in dominating areas of executive concerns: Corporate Governance, Vertical Integration, Outsourcing, and we discuss the future of the Gig Economy.
LO: Analyse real-world managerial economics problems with a systematic theoretical framework.",,,,,,,Likely,"Description [Systemic]: During the course we will touch the role of risk management systems, disaster-management systems, and effective decision making under uncertainty.
LO: Develop the internal and external managerial economics decisions apparatus to make efficient decisions",,https://anu365.sharepoint.com/:f:/r/sites/AcademicPortfolioInitiatives/Shared%20Documents/Curriculum%20Reform/Curriculum%20Updates/TD%20Course%20List%20Assessments?csf=1&web=1&e=eApdfk
ECON2026,Money and Banking,https://cms.anu.edu.au/cms/design/course/32320/view,17-Jul-24,24-Jan-19,,Open to all students,Completed minimum of 24 units,Somewhat Likely (Material),LO: Understand several key models and concepts of monetary economics and banking theory,Somewhat Likely,"Could be revised.
LO: Appreciate the potential importance of monetary phenomenon in the economy
",,,,,,,,,"CONTEXT Could be made explicit in the description with the use of real-world situations. For example, ""This includes analysis of monetary innovations through crypto-currencies such as ""bit-coin"", and the shadow banking systems that played a significant role in the Global Financial Crisis. """,https://anu365.sharepoint.com/:f:/r/sites/AcademicPortfolioInitiatives/Shared%20Documents/Curriculum%20Reform/Curriculum%20Updates/TD%20Course%20List%20Assessments?csf=1&web=1&e=eApdfk
ECON2091,"The Economy, Politics and the State",https://programsandcourses.anu.edu.au/course/ECON2091,18-Jun-24,27-Jan-18,,Open to students with particular courses,Normally completed at least 48 units,Somewhat Likely (Material),,Somewhat Likely,LO: Appreciate the concept of endogenous economic policy decisions,Somewhat Likely,"Description: The course seeks to develop an understanding of how governments actually use their  'policy space' in economic matters, and how they actually respond to expansions (or contractions) in that space.
LO: Discern the political economy angle of concrete policy problems
",,,,,,,,https://anu365.sharepoint.com/:f:/r/sites/AcademicPortfolioInitiatives/Shared%20Documents/Curriculum%20Reform/Curriculum%20Updates/TD%20Course%20List%20Assessments?csf=1&web=1&e=eApdfk
ECON2108,Japanese Economy and Economic Policy,https://programsandcourses.anu.edu.au/course/ECON2108,18-Jun-24,21-Apr-22,,Open to students with particular courses,Normally completed at least 48 units,Somewhat Likely (Material),LO: apply economic analysis to current issues facing Japan;,Somewhat Likely,"LO: demonstrate knowledge about contemporary public policy choices in Japan
LO: Demonstrate an understanding of current issues in the Australia-Japan relationship.",Somewhat Likely,Description:  Stress will be given to the analytic and policy interest in the operation and management of an economic system built on different social and institutional foundations from that of our own,,,,,,,,https://anu365.sharepoint.com/:f:/r/sites/AcademicPortfolioInitiatives/Shared%20Documents/Curriculum%20Reform/Curriculum%20Updates/TD%20Course%20List%20Assessments?csf=1&web=1&e=eApdfk
ECON2141,Strategic Thinking,https://programsandcourses.anu.edu.au/course/ECON2141,15-Jul-24,23-Dec-20,,Open to all students,Normally completed at least 24 units,Somewhat Likely (Material),"LO: Game theory has successfully been applied in a diverse range of fields, such as economics, political science, military analysis, law, biology and computer science.",Somewhat Likely,LO:  Demonstrate an understanding of the tools taught in class and be able to recognise their application to the analysis of real world situations.,Somewhat Likely,LO: Recognise the strategic issues in a problem and demonstrate an understanding of how a game theorist might decide on the appropriate tools to analyse it.,,,,,,,,
ECON2900,Development Poverty and Famine,https://programsandcourses.anu.edu.au/course/ECON2900,18-Jun-24,22-Apr-21,,Open to students with particular courses,Normally completed at least 48 units,Somewhat Likely (Material),Description: The course will cover both theory and empirical evidence but focusing mainly on how to conduct empirical analysis in understanding these important economic development issues.,Likely,"Why are some countries richer than others? Why have some countries experienced growth miracles while others have experienced stagnation or even growth disasters? Within developing countries, what does it mean to be poor? How to combat poverty? What are the challenges that the poor in developing countries face and what can be done to improve their living standards? ",Likely,"Description: The topics covered will include explanations on why countries develop differentially, the effect of geography, institutions, foreign aid, corruption and differential, saving rates on the large disparities across countries. 
Description: This course intends to teach students what we know and what we do not know about these important questions and will focus on teaching students tools in understanding them. 
NOTE: Course has no recorded LOs.",,,,,,,,https://anu365.sharepoint.com/:f:/r/sites/AcademicPortfolioInitiatives/Shared%20Documents/Curriculum%20Reform/Curriculum%20Updates/TD%20Course%20List%20Assessments?csf=1&web=1&e=eApdfk
ECON3004,Health Economics,https://programsandcourses.anu.edu.au/course/ECON3004,18-Jun-24,28-Sep-21,,Open to students with particular courses,Normally completed at least 72 units,Somewhat Likely (Material),LO: be able to use microeconomic analysis to evaluate health economics issues,Somewhat Likely,"LO: define the determinants of the demand for health care, demand for health insurance and the supply of health, as well as health and health care production functions;",Somewhat Likely,"We will study how government policies help shape the healthcare sector. We will also learn economic methods for evaluating the effects of health care policies.
LO: define the determinants of the demand for health care, demand for health insurance and the supply of health, as well as health and health care production functions",,,,,,,,https://anu365.sharepoint.com/:f:/r/sites/AcademicPortfolioInitiatives/Shared%20Documents/Curriculum%20Reform/Curriculum%20Updates/TD%20Course%20List%20Assessments?csf=1&web=1&e=eApdfk
ECON3006,Financial Economics,https://programsandcourses.anu.edu.au/course/ECON3006,15-Jul-24,01-Nov-22,,Open to students with particular courses,Normally completed at least 72 units,Somewhat Likely (Material),"LO: define the classical finance model that underpins modern finance;
",Not Likely,"Needs a clearer statement around the broader context. Perhaps expansion of: ""This course examines the economic principles that determine the allocation of resources through time in market economies.""",Somewhat Likely,"Maybe: assess the economic efficiency of market outcomes for different market structures, in the presence of market frictions and/or government intervention;",,,Somewhat Likely,"Description: assess the economic efficiency of market outcomes for different market structures, in the presence of market frictions and/or government intervention;",,,,https://anu365.sharepoint.com/:f:/r/sites/AcademicPortfolioInitiatives/Shared%20Documents/Curriculum%20Reform/Curriculum%20Updates/TD%20Course%20List%20Assessments?csf=1&web=1&e=eApdfk
ECON3023,Economic Policy Issues,https://programsandcourses.anu.edu.au/course/ECON3023,18-Jun-24,01-Nov-22,,Open to students with particular courses,Normally completed at least 72 units,Somewhat Likely (Material),"Description: The primary emphasis is on the relationships between economic research and economic policy objectives, but discussions also place the research in its social, political and historical environment.
LO: apply economic theory and various statistical techniques to judge effectiveness and outcomes of policies",Somewhat Likely,LO: describe how new research strategies have been applied across different policy areas by focusing on their strengths and weaknesses from the viewpoint of their practical importance in the policy area of interest;,Likely,"Description: This course analyses, discusses and critiques recent and important applied empirical research papers directed towards contemporary economic policy issues.
LO: demonstrate a general understanding of applied research publications that have sought to analyse effectiveness of particular aspects of contemporary economic policy",,,,,Somewhat Likely,LO: express your intuition and analytical ability to make judgments in policy areas where there is insufficient knowledge about key relationships that matter,,https://anu365.sharepoint.com/:f:/r/sites/AcademicPortfolioInitiatives/Shared%20Documents/Curriculum%20Reform/Curriculum%20Updates/TD%20Course%20List%20Assessments?csf=1&web=1&e=eApdfk
ECON3103,International Economics,https://programsandcourses.anu.edu.au/course/ECON3103,18-Jun-24,09-Feb-23,,Open to students with particular courses,Normally completed at least 72 units,Somewhat Likely (Material),"LO: to apply economic reasoning to issues of the day surrounding globalization,",Somewhat Likely,"Description: How does international trade affect individual firms, consumers, workers and industries? Why do some firms decide to export but not others? What is the impact of government policies on trade and welfare, and what are the best policies? 

LO: demonstrate an understanding of economists    arguments concerning trade policy and its analysis,
",Somewhat Likely,Perhaps: LO: Demonstrate an understanding of the main economic theories and models of international trade,,,,,,,,https://anu365.sharepoint.com/:f:/r/sites/AcademicPortfolioInitiatives/Shared%20Documents/Curriculum%20Reform/Curriculum%20Updates/TD%20Course%20List%20Assessments?csf=1&web=1&e=eApdfk
